url;title;content
https://www.cnnindonesia.com/internasional/20250810030856-134-1260754/polisi-tangkap-365-demonstran-bela-palestina-di-london;No Title;"Kepolisian Metropolitan London menangkap setidaknya 365 demonstran pro-Palestina yang melakukan aksi besar-besaran di London, Inggris, Sabtu (9/8). Ini merupakan aksi terbesar sejak pemerintah Inggris melarang aksi demonstrasi mendukung Palestina berdasarkan undang-undang anti-terorisme.
Kepolisian Metropolitan mengatakan telah menangkap ratusan orang. Ini diperkirakan menjadi salah satu penangkapan orang terbanyak dalam sejarah demonstrasi di London.
MelansirAFP, ratusan peserta aksi itu ditangkap dengan alasan mendukung organisasi terlarang.
ADVERTISEMENT
SCROLL TO CONTINUE WITH CONTENT
Mereka juga menangkap tujuh orang atas pelanggaran lain, termasuk penyerangan terhadap petugas, meskipun tidak ada yang mengalami luka serius.

Pemerintah melarang Palestine Action pada awal Juli, beberapa hari setelah kelompok tersebut mengaku bertanggung jawab atas aksi pencurian di pangkalan udara militer di selatan Inggris yang menyebabkan kerusakan senilai £7 juta pada dua pesawat.
Kelompok tersebut menyatakan bahwa aktivisnya merespons dukungan militer tidak langsung Inggris untuk Israel di tengah agresi ke wilayah Gaza.
Kementerian Dalam Negeri Inggris kembali menegaskan bahwa Palestine Action juga diduga terlibat dalam serangan-serangan serius lainnya yang melibatkan kekerasan, cedera parah, dan kerusakan.
Namun, PBB dan LSM seperti Amnesty International dan Greenpeace, mengecam langkah tersebut sebagai penyalahgunaan hukum dan ancaman terhadap kebebasan berbicara.
Kelompok Defend Our Juries, yang mengorganisir protes pada Sabtu dan demonstrasi sebelumnya menentang larangan tersebut, Mereka mengatakan bahwa kepolisian belum pernah menangkap demonstran sebanyak ini.

""Kami akan terus berjuang. Jumlah kami sudah bertambah untuk gelombang aksi berikutnya pada September,"" kata mereka.
Aksi ini dimulai saat makan siang di dekat gedung parlemen. Mereka membawa sejumlah spanduk menolak genosida yang dilakukan Israel, hingga bendera Palestina.
Psikoterapis Craig Bell, 39 tahun, termasuk di antara mereka yang memegang spanduk. Dia menyebut larangan menggelar aksi demonstrasi mendukung Palestina adalah keputusan yang sangat konyol.





""Ketika Anda membandingkan Palestine Action dengan kelompok teroris sungguhan yang membunuh warga sipil dan merenggut nyawa, sungguh lucu bahwa mereka dikategorikan sebagai kelompok teroris,"" katanya kepada AFP.
Saat polisi menangkapi sejumlah peserta aksi, massa bertepuk tangan menyemangati mereka, seraya menyoraki para petugas.
""Biarkan mereka menangkap kita semua,"" kata Richard Bull, 42, seorang pengguna kursi roda yang hadir. ""Pemerintah ini sudah kelewatan. Saya tidak punya alasan untuk merasa malu.""

Menurut kepolisian ratusan orang yang ditangkap ditahan untuk sementara waktu. Mereka akan dimintai keterangan lebih lanjut serta diverifikasi. Polisi mengungkap mereka kemungkinan bisa dibebaskan atau dipindahkan ke tahanan lain.
Sacha Deshmukh, Direktur Eksekutif Amnesty International UK, menulis surat kepada Kepala Polisi Met Mark Rowley pekan ini, mendesak agar tindakan penegakan hukum terhadap orang-orang yang mendukung Palestine Action dilakukan dengan kehati-hatian.
Amnesty juga menyebut penangkapan terhadap orang-orang tersebut melanggar hukum hak asasi manusia internasional."
https://www.cnnindonesia.com/internasional/20250810015714-134-1260752/rusia-kecam-rencana-israel-okupasi-gaza-krisis-bisa-makin-buruk;No Title;"Kementerian Luar Negeri Rusia mengecam rencanaIsraelmengokupasiGaza Citydi Jalur Gaza, Palestina. Rusia mengatakan hal itu berisiko memperburuk krisis kemanusiaan di Jalur Gaza.
""Menerapkan rencana semacam itu berisiko memperburuk situasi yang sudah dramatis di wilayah Palestina tersebut, yang menunjukkan semua tanda-tanda bencana kemanusiaan,"" kata pernyataan kementerian tersebut, melansirAFP, Sabtu (9/8).

ADVERTISEMENT
SCROLL TO CONTINUE WITH CONTENT
Arab Saudi juga mengecam keras keputusan Israel untuk merebut Gaza City.
Dalam pernyataan pada Jumat (8/8), Kementerian Luar Negeri Saudi menyatakan keputusan tersebut merupakan ""kegigihan otoritas Israel dalam melakukan kejahatan krisis kelaparan, praktik-praktik brutal, dan pembersihan etnis terhadap warga Palestina"", demikian dikutipAl Arabiya.
Kabinet keamanan Israel pada Jumat pagi menyetujui rencana Perdana Menteri Benjamin Netanyahu untuk mengambil alih Gaza City. Keputusan itu diambil setelah Netanyahu sebelumnya berniat untuk mencaplok sepenuhnya Jalur Gaza.
Kendati demikian, rencana perebutan total ini telah dikecam berbagai pihak, termasuk Perserikatan Bangsa-Bangsa (PBB).

Kepala Staf Militer Israel (IDF), Letnan Jenderal Eyal Zamir, juga termasuk di antara pihak yang mewanti-wanti Netanyahu soal risiko rencana pencaplokan total Gaza.
Menurut tiga sumber yang mengetahui jalannya pembahasan, Zamir menegaskan bahwa penaklukan penuh Gaza akan membuat militer terjebak di dalam wilayah tersebut dan membahayakan keselamatan para sandera yang masih ditahan.
Sejumlah citra satelit menunjukkan pasukan Israel tengah bersiap melancarkan serangan darat skala besar yang diduga untuk merebut Gaza City, Jalur Gaza, Palestina.
NBCNews pada Jumat (8/8) melaporkan bahwa militer Israel tampak sudah mulai mengumpulkan prajurit dan peralatan di dekat perbatasan Gaza.


"
https://www.cnnindonesia.com/internasional/20250809223328-120-1260748/ledakan-di-gudang-senjata-hizbullah-6-tentara-lebanon-tewas;No Title;"Sebanyak enam tentaraLebanontewas usai ledakan terjadi di gudang senjata milikHizbullahdekat perbatasan Israel, Sabtu (9/8). Pasukan sedang mengangkut amunisi dari fasilitas Hizbullah saat insiden ledakan terjadi.
Pernyataan resmi militer menyebutkan korban awal enam tentara tewas. Insiden ini terjadi ketika militer memeriksa gudang senjata Hizbullah.
""[Ledakan terjadi]Saat unit militer memeriksa gudang senjata dan membongkar isinya di Wadi Zibqin, di distrik Tyre dekat perbatasan Israel,"" demikian pernyataan militer Lebanon, mengutip AFP, Sabtu (9/8).
ADVERTISEMENT
SCROLL TO CONTINUE WITH CONTENT
Militer menambahkan saat ini proses investigasi sedang berlangsung untuk menentukan penyebab ledakan.

Seorang sumber militer, yang meminta namanya tak disebutkan karena tidak berwenang untuk memberikan keterangan kepada media, mengatakan bahwa ledakan terjadi di dalam fasilitas militer Hizbullah.
""Pasukan sedang mengangkut amunisi dan bahan peledak yang belum meledak sisa perang baru-baru ini saat ledakan terjadi,"" kata sumber tersebut.
Presiden Joseph Aoun mengaku sudah mengetahui insiden ledakan itu. Ia diberitahu oleh Komandan Angkatan Darat Rodolphe Haykal tentang insiden tersebut.
Perdana Menteri Nawaf Salam mengucapkan belasungkawa kepada pasukan yang tewas saat menjalankan tugas.

Insiden itu terjadi setelah pemerintah Lebanon setuju untuk mendesak Hizbullah menyerahkan senjatanya. Pemerintah menugaskan para tentara untuk menyusun rencana menyelesaikan proses tersebut hingga akhir tahun.
Hizbullah mengaku menolak keputusan kabinet untuk menyerahkan senjata. Mereka menganggap keputusan itu diambil di bawah tekanan berat dari AS.
Iran, yang ada di belakang Hizbullah, juga menegaskan menentang keputusan tersebut.






Sebelumnya, sejak gencatan senjata antara Hizbullah dengan Israel akhir tahun lalu, pemerintah Lebanon menempatkan pasukannya di selatan dan menginstruksikan agar membongkar infrastruktur kelompok militan tersebut.
Komandan Pasukan Penjaga Perdamaian PBB di Lebanon (UNIFIL), Mayor Jenderal Diodato, Abagnara mengatakan para prajurit tersebut sedang menjalankan tugasnya untuk memulihkan stabilitas dan mencegah kembalinya konflik terbuka.
Ledakan tersebut terjadi beberapa hari setelah juru bicara UNIFIL, Andrea Tenenti, mengatakan bahwa pasukan telah menemukan jaringan terowongan yang diperkuat di wilayah yang sama.
Juru bicara PBB, Farhan Haq, mengatakan bahwa pasukan menemukan persediaan artileri, roket, ranjau, dan bahan peledak improvisasi.
"
https://www.cnnindonesia.com/internasional/20250809211214-134-1260743/tabrakan-maut-bus-dan-truk-11-orang-tewas-dan-45-luka;No Title;"Sebuah insidentabrakan mautantara bus dan truk di Mato Grosso, Brasil, pada Sabtu (9/8), menewaskan sedikitnya 11 orang. Selain itu, 45 orang lainnya dikabarkan cedera.
Operator jalan tol dan polisi jalan raya federal Brasil mengumumkan korban luka-luka dibawa ke rumah sakit terdekat. Di antara korban luka, 11 orang dalam kondisi kritis, 26 dalam kondisi sedang, dan delapan orang lainnya hanya mengalami luka ringan.

ADVERTISEMENT
SCROLL TO CONTINUE WITH CONTENT
MelansirReuters, informasi awal mengungkap bahwa sebuah bus bertabrakan dengan truk yang mengangkut biji kapas di dekat kota Lucas do Rio Verde.
Menurut perusahaan biji kapan tersebut, pihaknya telah diberitahu tentang kecelakaan tersebut pada pukul 9:40 malam waktu setempat pada Jumat (8/8).
"
https://www.cnnindonesia.com/internasional/20250809173323-120-1260706/unrwa-banyak-negara-tetap-terjunkan-bantuan-via-udara-ke-gaza;No Title;"Badan di bawah Perserikatan Bangsa-Bangsa (PBB) untuk urusan Pengungsi Palestina (UNRWA) menyatakan meskipun tidak efektif dan berisiko, sejumlah negara tetap menyalurkan bantuan kemanusiaan dengan cara diterjunkan dari udara ke dalam wilayah keGaza, Palestina.
Hal itu disampaikan UNRWA dalam unggahan di akun media sosial X mengenai laporan di Gaza hari ini, Sabtu (9/8).
UNRWA menyatakan pihaknya masih tidak diperbolehkan Israel--yang memblokir kawasan--untuk membawa atau mengirim bantuan kemanusiaan ke wilayah Gaza. Pencekalan UNRWA mengirim bantuan, termasuk obat-obatan dan peralatan medis--ke Gaza itu telah berlangsung lebih dari lima bulan.
ADVERTISEMENT
SCROLL TO CONTINUE WITH CONTENT
""Di Gaza, pengiriman bantuan melalui udara dari beberapa negara anggota terus berlanjut, meskipun ada peringatan dari beberapa badan internasional bahwa pengiriman bantuan melalui udara sangat mahal dan tidak efektif,"" kata mereka.

Sejak gagalnya gencatan senjata pada 18 Maret dan hingga 27 Juli lalu, UNRWA menyatakan tim kesehatannya telah membantu  lebih dari 1,5 juta konsultasi kesehatan di seluruh Gaza.
Selain di Gaza, UNRWA mengungkapkan kondisi yang tak kalah memprihatinkan di Tepi Barat, Palestina.
""Di Tepi Barat utara sekitar 30.000 penduduk kamp pengungsi Nur Shams, Tulkarm, dan Jenin tidak dapat kembali ke rumah mereka akibat operasi besar-besaran 'Tembok Besi' dari Pasukan Israel yang berlangsung sejak Januari 2025,"" katanya.
Indonesia termasuk negara yang akan mengirim bantuan ke Gaza, termasuk lewat udara.
Menteri Luar Negeri Sugiono terlihat mengikuti aksi bela Palestina yang digelar di kawasan Monumen Nasional (Monas) pada Minggu (3/8) pagi. Ia juga berorasi dalam acara tersebut.
Dalam orasi, Menlu Sugiono mengatakan Indonesia akan terus mengirimkan bantuan ke Palestina. Dalam waktu dekat, Indonesia akan mengirim 10 ribu ton beras ke Palestina.

Kepala Kantor Komunikasi Kepresidenan (PCO) Hasan Nasbi, Kamis (7/8) menyatakan Indonesia juga direncanakan akan terlibat dalam pengiriman bantuan kemanusiaan, terutama berupa bahan pangan, melalui operasi udara.
""Ada juga arahan dari Presiden kemarin agar pemerintah Indonesia terlibat juga dalam pengiriman bantuan kemanusiaan ke Gaza,"" ucap dia.
Untuk mendukung pengiriman bantuan tersebut, Presiden telah meminta Kementerian Pertahanan menyiapkan dua unit pesawat Hercules untuk melaksanakan pemberian bantuan kemanusiaan lewat udara di wilayah Gaza.
""Jadi menurunkan bantuan pangan, bantuan untuk para warga Gaza dari udara. Jadi Indonesia juga selain akan mengirimkan pasukan perdamaian ke Gaza juga akan terlibat dalam pengiriman bantuan kemanusiaan via udara. Jadi disiapkan dua Hercules untuk mengedrop bantuan pangan,"" kata Hasan.
Sementara itu, Dewan Keamanan PBB menggelar pertemuan akhir pekan ini untuk membahas situasi di Timur Tengah, terutama Gaza, Palestina.
Mengutip dariReuters,jadwal pertemuan itu dibuat Jumat (8/8) setelah pemerintahan Israel mengeluarkan pernyataan bakal mengambil alih kontrol Gaza dan memberi tenggat waktu hingga 7 Oktober buat warga di sana.
Pengamat tetap Negara Palestina untuk PBB, duta besar Riyad Mansour, mengatakan sejumlah negara akan meminta Dewan Keamanan PBB untuk mengadakan pertemuan mengenai rencana Israel.
Melansir dari laman resmi DK PBB, pertemuan ke-9975 itu akan digelar di markas PBB, New York, Amerika Serikat (AS) pada Minggu (10/8) pukul 10.00 pagi waktu setempat atau pukul 21.00 WIB.
""Situasi di Timur Tengah, termasuk pertanyaan soal Palestina,"" demikian dikutip dari laman tersebut.

Sebelumnya pada Kamis (7/8) lalu, Kabinet Keamanan Israel menyetujui rencana pendudukan Kota Gaza di bagian utara wilayah kantung tersebut.
Perdana Menteri Israel Benjamin Netanyahu mengatakan pemerintahnya ingin mengambil alih secara penuh kendali di Gaza menjelang sidang Kabinet.

Sementara itu, Indonesia mengutuk keputusan sepihak Israel untuk mengambil alih Jalur Gaza.
Mengutip dari informasi di akunXKemenlu RI, kantor diplomat Indonesia itu menyatakan tindakan Israel untuk mengambil alih kontrol Gaza tersebut merupakan pelanggaran berat atas hukum internasional dan Piagam PBB.
Dalam unggahan yang dibuat Sabtu dini hari itu, Kemenlu RI menyatakan tindakan Israel itu juga akan memperkeruh prospek perdamaian di Timur Tengah dan krisis kemanusiaan di Gaza.
Kemlu pun mengutip keputusan Mahkamah Internasional (ICJ) yang menegaskan bahwa pendudukan Israel atas wilayah Palestina adalah ilegal.
Indonesia juga mendesak Dewan Keamanan PBB dan masyarakat internasional mengambil langkah konkret untuk menghentikan tindakan ilegal Israel tersebut, kata Kemlu RI.
Sebelumnya, kabinet Israel membahas rencana untuk melakukan operasi militer yang baru di Jalur Gaza, sebut laporan media setempat.
Mengutip sumber di pemerintahan Israel,Jerusalem Postsebelumnya memberitakan rapat kabinet soal keputusan untuk kembali menduduki Gaza. Hal itu terjadi di tengah kebuntuan dalam negosiasi dengan kelompok pejuang Palestina di Gaza, Hamas
Rencana itu didukung pemimpin Israel Benjamin Netanyahu dan akan melibatkan pengerahan lima divisi militer Israel (IDF). Operasi militer tersebut diperkirakan berlangsung lima bulan dan mencakup pemindahan sekitar satu juta warga Palestina dari Gaza.
[Gambas:Twitter]
Kemenkes Palestina di Gaza yang dikelola Hamas menyatakan ada 38 orang tewas di kawasan tersebut dalam 24 jam terakhir. Dalam pernyataannya menyebut 21 orang tewas di dekat posko distribusi bantuan kemanusiaan, dan 11 kematian terkait kelaparan serta malnutrisi.
Jumlah itu membuat korban tewas akibat pelaparan karena blokade Israel di Gaza mencapai 201 orang sejauh ini.
Sejak Oktober 2023 lalu, agresi Israel ke Gaza dengan dalih memburu milisi Hamas telah menewaskan 61.330 orang dan melukai 152.359 orang."
https://www.cnnindonesia.com/internasional/20250809183327-106-1260726/kemlu-ri-kecam-israel-caplok-gaza-pelanggaran-berat-piagam-pbb;No Title;"Kementerian Luar Negeri (Kemlu) Indonesia mengecam keras niatIsraelmerebut total Gaza,Palestina.
""Indonesia mengecam keras keputusan sepihak Israel untuk mengambil alih Gaza. Tindakan tersebut merupakan pelanggaran berat hukum internasional dan Piagam PBB yang memperkeruh prospek perdamaian di Timur Tengah dan krisis kemanusiaan di Gaza,"" tulis akun X @Kemlu_RI, Jumat (8/8).

ADVERTISEMENT
SCROLL TO CONTINUE WITH CONTENT
Kemlu mengutip penjelasan Mahkamah Internasional, di mana okupasi Israel atas wilayah pendudukan Palestina merupakan tindakan ilegal. Israel juga diklaim tidak memiliki kedaulatan terhadap wilayah pendudukan tersebut.
Tindakan apapun yang diambil Israel disebut tidak dapat mengubah status hukum dari wilayah Palestina.
""Indonesia mendesak Dewan Keamanan PBB dan masyarakat internasional mengambil langkah konkret untuk menghentikan tindakan illegal Israel,"" desak Kemlu Indonesia.
Pemerintah Indonesia menegaskan konsisten mendukung penuh negara Palestina yang merdeka dan berdaulat. Di lain sisi, Indonesia mendesak solusi dua negara yang harus diwujudkan melalui tiga langkah utama.
Pertama, pengakuan atas negara Palestina oleh semua negara. Kedua, penghentian kekerasan dan gencatan senjata. Ketiga, penentuan masa depan Palestina oleh rakyat Palestina.
Israel saat ini mengklaim sudah menguasai 75 persen Jalur Gaza. Sedangkan 25 persen wilayah sisanya diyakini merupakan tempat para sandera Israel ditahan.

Perdana Menteri Israel Benjamin Netanyahu berencana menaklukkan penuh Jalur Gaza, Palestina melalui operasi baru. Alasannya, operasi baru mesti ditempuh demi membawa pulang sandera dengan aman.
Israel bahkan sudah memberi waktu warga Gaza hingga 7 Oktober 2025 untuk mengungsi atau melakukan evakuasi. Arahan itu diberikan sebelum militer Israel menduduki Jalur Gaza secara penuh.
Rentang waktu dua bulan itu diberikan bertepatan dengan peringatan dua tahun serangan Hamas terhadap Israel pada 2023 lalu.


"
https://www.cnnindonesia.com/internasional/20250809165920-134-1260699/zelensky-respons-rencana-pertemuan-trump-dan-putin-di-alaska;No Title;"Presiden UkrainaVolodymyr Zelenskymerespons rencana pertemuan Presiden Amerika Serikat (AS)Donald Trumpdengan Presiden RusiaVladimir Putindi Alaska pada 15 Agustus 2025.
Zelensky menegaskan tetap menentang ide apapun yang berujung pada penyerahan wilayah Ukraina. Ini menyusul tawaran Putin ke Trump untuk menghentikan peperangan dengan Ukraina, asalkan bisa mengantongi konsesi wilayah yang signifikan.
""Semua mitra harus memahami apa itu perdamaian yang layak,"" tegas Zelensky, dikutip dariCNN, Sabtu (9/8).
ADVERTISEMENT
SCROLL TO CONTINUE WITH CONTENT
""Kami siap bekerja sama dengan Presiden Trump, bersama semua mitra kami, demi perdamaian yang sejati. Dan yang terpenting, abadi, perdamaian yang tidak akan runtuh karena keinginan Moskow,"" sambungnya.

Putin disebut-sebut membuat penawaran dengan utusan Trump, yakni Steve Witkoff pada Rabu (6/8) lalu. Rusia diklaim meminta Ukraina menyerahkan wilayah Donbas timur serta Krimea agar peperangan berakhir.
Sementara itu, Presiden AS Donald Trump juga menyinggung rencana 'pertukaran wilayah' demi kebaikan Ukraina dan Rusia. Orang nomor satu di Amerika itu belum menjelaskan lebih lanjut terkait rencana tersebut.
""Pertemuan yang sangat dinantikan antara saya sebagai Presiden AS dan Presiden Vladimir Putin dari Rusia, akan berlangsung Jumat depan, 15 Agustus 2025, di negara bagian Alaska,"" ucap Trump dalam situs Truth Social miliknya, dikutip dariAFP.
Pertemuan di Alaska bakal menjadi yang pertama bagi Trump setelah menjabat kembali sebagai Presiden AS. Trump dan Putin terakhir kali bertemu pada 2019 lalu di KTT G20 Jepang.

Di lain sisi, tiga putaran negosiasi antara Rusia dan Ukraina gagal membuahkan hasil. Vladimir Putin juga menolak seruan AS dan negara-negara Eropa untuk melakukan gencatan senjata. Ia pun mengesampingkan opsi diskusi bersama Presiden Ukraina Volodymyr Zelensky."
https://www.cnnindonesia.com/internasional/20250809184553-113-1260730/korut-bongkar-speaker-untuk-ganggu-korsel-ada-apa;No Title;"Tentara Korea Utara mulai membongkar pengeras suara (loud speaker) propaganda yang digunakan untuk menyiarkan suara-suara yang mengganggu di sepanjang perbatasan, demikian pernyataan militer Korea Selatan pada Sabtu (9/8).
Hal ini terjadi beberapa hari setelah pemerintahan baru Seoul juga membongkar pengeras suara di sisi perbatasan.
Pada Juni, kedua negara juga telah menghentikan siaran propaganda di sepanjang zona demiliterisasi, terutama setelah terpilihnya Presiden Lee Jae Myung. Menurut militer Korsel, kedua negara pun tengah berupaya meredakan ketegangan.
ADVERTISEMENT
SCROLL TO CONTINUE WITH CONTENT
Pada Senin lalu, kementerian pertahanan Korea Selatan mengatakan pihaknya telah mulai membongkar pengeras suara dari sisi perbatasan.

Korea Selatan menyiarkan lagu K-pop dan laporan berita ke Korut sebagai balasan atas Pyongyang yang menggaungkan suara-suara aneh dan mengganggu di sepanjang perbatasan.
Namun, di bawah pemerintahan Lee pada bulan Juni, Seoul menghentikan siaran ini dan sebagai balasannya, sehari kemudian, Korea Utara juga menghentikan siaran mereka.
""Sejak pagi ini, militer Korea Selatan telah mendeteksi pasukan Korea Utara membongkar pengeras suara propaganda di beberapa bagian,"" kata Kepala Staf Gabungan Seoul, seperti dikutip dari AFP.
""Masih harus dikonfirmasi apakah perangkat-perangkat tersebut telah dibongkar di semua wilayah,"" ujarnya lagi.
Seoul memulai siaran pengeras suara tahun lalu sebagai respons terhadap rentetan balon berisi sampah yang diterbangkan ke selatan oleh Pyongyang.
Korea Utara telah mengirim ribuan balon ke selatan pada saat itu, mengatakan bahwa itu adalah pembalasan atas balon-balon propaganda yang diluncurkan oleh para aktivis Korea Selatan.
Hubungan antara kedua Korea berada pada salah satu titik terendah dalam beberapa tahun, di bawah presiden Korea Selatan saat itu, Yoon Suk Yeol, dengan Seoul mengambil pendekatan garis keras terhadap Pyongyang,
Sementara Lee telah mengambil pendekatan yang berbeda dalam menghadapi Korea Utara.
Ia bahkan meminta kelompok-kelompok sipil untuk berhenti mengirim pamflet propaganda anti-Korea Utara. Lee juga mengatakan ia akan coba berbicara dengan Korea Utara tanpa prasyarat, setelah pendahulunya membekukan hubungan kedua negara.
Secara teknis keduanya masih dalam keadaan perang karena Perang Korea 1950-53 berakhir dengan gencatan senjata, bukan perjanjian damai.
"
https://www.cnnindonesia.com/internasional/20250809142328-134-1260648/trump-lagi-pikir-pikir-untuk-longgarkan-aturan-ganja;No Title;"Presiden Amerika SerikatDonald Trumpdilaporkan sedang mempertimbangkan pengklasifikasian ulangganja. Daun mariyuana tersebut rencananya bakal dikategorinya sebagai 'obat yang kurang berbahaya'.
Informasi tersebut dilaporkanWall Street Journalyang mengutip sumber-sumber anonim, yang mengetahui rencana tersebut.
MengutipReuters, pada awal Agustus lalu, Trump sempat menyampaikan dalam sebuah acara penggalangan dana di klub golf miliknya di New Jersey bahwa ia tertarik untuk melakukan perubahan klasifikasi ganja.
ADVERTISEMENT
SCROLL TO CONTINUE WITH CONTENT
Para tamu dalam acara penggalangan dana tersebut termasuk Kim Rivers, CEO Trulieve, salah satu perusahaan ganja terbesar, mendorong Trump untuk melakukan perubahan tersebut dengan cepat dan memperluas penelitian ganja medis.

MenukilCNN, pada masa kampanyenya, Trump juga pernah berjanji untuk membuka era baru bagi ganja. Kala itu, ia ingin mempermudah akses bagi orang dewasa terhadap produk ganja yang aman dan memberi negara bagian keleluasaan untuk melegalkan penggunaan ganja.
Kala itu, ia menyampaikan dukungannya untuk mengeluarkan ganja dari kategori hukum yang sama seperti narkotika berbahaya seperti heroin.
Namun, sejak ia dilantik kembali menjadi Presiden AS pada Januari lalu, komitmennya terhadap ganja belum juga direalisasikan.
Dalam pernyataan kepadaCNN, Juru Bicara Gedung Putih, Abigail Jackson, mengatakan bahwa semua persyaratan dan implikasi kebijakan serta hukum terkait ganja sedang dipertimbangkan.
Isu aturan soal ganja pun menimbulkan perpecahan tajam di dalam tim Trump. Penasihat politik utama Trump yang memimpin dorongan agresif untuk memenuhi janji kampanye, telah mendesak agar langkah tersebut segera diambil. Mereka berpendapat bahwa langkah ini bisa membantu memperkuat dukungan Partai Republik menjelang pemilu paruh waktu.
Namun, penasihat kebijakan lainnya tetap berhati-hati, memperingatkan bahwa dampak moral dan hukum dari pelonggaran pembatasan ganja bisa lebih besar dari manfaat yang diharapkan, bahkan bisa berdampak politik yang merugikan.
Saat ini, ganja diklasifikasikan sebagai obat Schedule 1. Kategori ini untuk zat-zat terlarang yang dianggap tidak memiliki manfaat medis dengan potensi penyalahgunaan yang tinggi.
Trump sebelumnya pernah menyatakan dukungan memindahkan klasifikasi ganja ke Schedule 3. Kategori ini untuk obat-obatan dengan potensi ketergantungan fisik dan psikologis yang sedang hingga rendah.


"
https://www.cnnindonesia.com/internasional/20250809160048-124-1260685/video-israel-beri-waktu-warga-gaza-evakuasi-hingga-7-oktober;No Title;"Israel memberi waktu warga Gaza, Palestina, hingga 7 Oktober 2025 mendatang untuk mengungsi atau melakukan evakuasi.
Arahan itu diberikan sebelum militer Israel menduduki Jalur Gaza secara penuh.
Hal tersebut disampaikan oleh pejabat senior Israel yang tidak ingin disebutkan namanya.
Berdasarkan rencana yang disetujui kabinet, warga sipil Gaza akan dievakuasi ke wilayah selatan.
Ia juga mengatakan, militer Israel (IDF) kemudian akan melancarkan serangan darat ke Gaza, mengepung wilayah tersebut untuk menghabisi semua anggota Hamas yang tersisa."
