url;title;content
https://www.cnnindonesia.com/internasional/20250805110650-106-1258829/india-filipina-perdana-latihan-militer-di-lcs-china-dongkol;No Title;"IndiadanFilipinauntuk pertama kalinya menggelar latihan militer di perairan yang disengketakan, Laut China Selatan (LCS).
Militer Filipina menyatakan mereka dan India melakukan latihan dua hari, sejak Minggu (3/8).
""Angkatan Bersenjata Filipina dan Angkatan Laut India melaksanakan Kegiatan Kerja Sama Maritim Bilateral pertama mereka dari tanggal 3 hingga 4 Agustus,"" demikian menurut militer Filipina, dikutipAnadolu Agency.
ADVERTISEMENT
SCROLL TO CONTINUE WITH CONTENT

Dalam latihan gabungan ini, Angkatan Laut India mengerahkan kapal perusak berpeluru kendali INS Delhi, kapal tanker INS Shakti, dan korvet INS Kiltan, sementara Filipina mengirimkan dua fregat, BRP Miguel Malvar dan BRP Jose Rizal.
Di tengah latihan itu tepatnya pada Minggu, militer Filipina juga mendeteksi kapal perusak China sekitar 26 mil dari tempat mereka berada.
Mereka juga menyebut kapal-kapal angkatan laut dan penjaga pantai China melakukan pengawasan dari jarak jauh dalam patroli gabungan sebelumnya dengan angkatan laut asing lain.
Menyaksikan kedua negara latihan bersama di LCS, China murka. Mereka turut melakukan patroli rutin di hari yang sama saat kedua negara itu latihan dan di lokasi yang berdekatan.

Pekan lalu, Kementerian Pertahanan Nasional China menjuluki Filipina sebagai pembuat onar. Mereka juga menyatakan negara itu secara strategis bersekutu dengan kekuatan asing untuk menimbulkan masalah di LCS.
China mengeklaim sebagian besar wilayah LCS dan kerap berselisih dengan berbagai negara yang punya perbatasan di perairan tersebut.
""China tak pernah goyah dalam tekad dan keinginannya untuk menjaga kedaulatan wilayah nasional serta hak dan kepentingan maritim dan akan mengambil tindakan balasan yang tegas terhadap setiap provokasi oleh pihak Filipina,"" ujar juru bicara Kementerian Pertahanan Kolonel Zhang Xiaogang, dikutipEuro News.
China punya sengketa wilayah dengan India dan Filipina.




China dan India kerap berselisih soal perbatasan di beberapa wilayah terutama di Himalaya. Sementara itu, mereka kerap berkonflik dengan Filipina karena klaim Second Thomas Shoal dan Scarborough Shoal di LCS.
Latihan militer Filipina-India berlangsung saat Presiden Ferdinand ""Bongbong"" Marcos berkunjung ke New Delhi.
Bongbong mengatakan Filipina dan India akan memperkuat kerja sama di berbagai bidang termasuk pertahanan.
""Kerja sama kita akan semakin intensif dan berdampak lebih besar di banyak bidang yang belum pernah kita jajaki dengan India sebelumnya, seperti pertahanan, perdagangan dan investasi, kesehatan, pariwisata, dan bidang lain,"" kata Bongbong."
https://www.cnnindonesia.com/internasional/20250805104730-134-1258825/mesin-rusak-saat-take-off-united-airlines-sinyal-mayday-putar-balik;No Title;"Pilot pesawat Boeing 787 milikUnited Airlinesmelakukan panggilan Mayday tak lama setelah lepas landas diduga karena mengalami kerusakan mesin.
Insiden ini terjadi saat Boeing 787 itu terbang dari Bandara Internasional Dulles, Washington, Amerika Serikat, menuju Munich, Jerman. Pesawat ini membawa 129 penumpang dan 11 awak.

ADVERTISEMENT
SCROLL TO CONTINUE WITH CONTENT
DilansirCNN, peringatan Mayday itu membuat pesawat putar balik dan kembali ke bandara Dulles. Panggilan ini menandakan keadaan darurat atau urgensi saat masalah terjadi di dalam pesawat.
Dalam pernyataan resmi, United Airlines menyatakan pesawat itu terpaksa kembali ke Dulles pada 25 Juli ""untuk mengatasi masalah mekanis.""
Beberapa menit setelah lepas landas dan di ketinggian hampir 5.000 kaki, pilot memberi tahu kontrol lalu lintas udara.
""Mesin rusak, mesin kiri, United 108 mengumumkan keadaan darurat. Mayday, mayday, mayday,"" demikian rekaman audio kontrol lalu lintas udara.
""Anda bisa kembali ke landasan saat ini,"" kata pengatur lalu lintas udara.




""Tak ada orang di antara Anda dan landasan saat ini,"" lanjut pengatur lalu lintas udara.
Data dari situs pelacakan penerbangan Flightradar24 menunjukkan pesawat lepas landas pukul 20.00 waktu setempat. Sekitar 30 menit kemudian, pesawat putar balik dan mendarat darurat di Dulles.
Pesawat mendarat dengan aman dan seluruh penumpang turun dengan selamat. United Airlines mengumumkan penerbangan itu dibatalkan dan akan mengatur perjalanan alternatif untuk para penumpang sesegera mungkin.
Sementara itu, Otoritas Bandara Metropolitan Washington (MWAA) telah memeriksa pesawat itu dan menyatakan insiden ini tak mengganggu operasi bandara.
""Tak ada gangguan pada penerbangan lain,"" demikian menurut MWAA.
"
https://www.cnnindonesia.com/internasional/20250804145530-134-1258521/cekcok-dengan-rusia-trump-klaim-kapal-selam-nuklir-as-sudah-siaga;No Title;"Presiden Amerika SerikatDonald Trumpmengatakan dua kapal selamnuklirAS telah tiba di ""tempat yang seharusnya"".
""Mereka berada di kawasan itu, di tempat yang seharusnya,"" kata Trump kepada wartawan sebelum kembali dari resor golfnya di New Jersey, Minggu (3/8).
Pernyataan Trump ini dilontarkan menyusul cekcoknya dengan eks Presiden Rusia Dmitry Medvedev.
ADVERTISEMENT
SCROLL TO CONTINUE WITH CONTENT

Trump sebelumnya terlibat adu mulut dengan Medvedev setelah sang eks Presiden mengancam bahwa negaranya akan menyerang AS jika Trump terus bertingkah dengan segala ultimatumnya.
""Entah itu 50 hari atau 10 hari ... Dia harus ingat 2 hal: 1. Rusia bukan Israel atau bahkan Iran. 2. Setiap ultimatum baru adalah ancaman dan langkah menuju perang. Bukan antara Rusia dan Ukraina, tetapi (antara Rusia) dengan negaranya sendiri,"" tulis Medvedev di X, Senin (28/7).
Menanggapi itu, Trump pada Kamis (31/7) memperingatkan Medvedev untuk menjaga ucapannya karena pernyataannya bisa memicu konsekuensi yang ""sangat berbahaya"".




""Beri tahu Medvedev, mantan Presiden Rusia yang gagal, yang merasa dirinya masih Presiden, untuk berhati-hati dalam bicara. Dia memasuki wilayah yang sangat berbahaya,"" tulis Trump di media sosialnya, Truth Social.
Tak lama setelah itu, Trump mengaku telah memerintahkan dua kapal selam nuklir ditempatkan di ""wilayah yang tepat"". Pengerahan itu dilakukan ""untuk berjaga-jaga apabila pernyataan bodoh dan provokatif"" Medvedev ""lebih dari sekadar itu.""
Ancaman nuklir ini terjadi di tengah tenggat waktu yang ditetapkan Trump hingga akhir pekan depan bagi Rusia untuk mengambil langkah-langkah guna mengakhiri perang di Ukraina. Trump mengancam apabila Rusia tak berhasil mengambil sikap, Kremlin akan dijatuhkan sanksi baru.
Kementerian Luar Negeri Rusia sejak awal telah menegaskan bahwa perdamaian dengan Ukraina hanya bisa dilakukan jika negara-negara Barat berhenti memasok persenjataan kepada Kyiv."
https://www.cnnindonesia.com/internasional/20250804205643-120-1258664/mengapa-israel-ingin-kuasai-masjid-al-aqsa-secara-brutal;No Title;"Masjid Al Aqsayang berada di Yerusalem, merupakan situs suci Umat Islam sejak lama.
Namun di kompleks tersebut juga menjadi situs suci tiga agama Islam, Kristen dan Yahudi.

ADVERTISEMENT
SCROLL TO CONTINUE WITH CONTENT
Meski terdapat masjid, namun warga Yahudi Israel selalu ingin mendatangi ke kompleks tersebut.
Mereka dengan sengaja dan provokatif datang dan beribadah di sana, seperti dilakukan Menteri Keamanan Nasional Israel Itamar Ben Gvir, yang secara terang-terangan mendatangi kompleks Al Aqsa.
Dia mengajak warga Yahudi untuk beramai-ramai berkunjung ke sana dan beribadah. Kunjungan itu dilakukan pada Hari Paskah, yang juga berbarengan dengan bulan suci Ramadan tahun lalu.

""Temple Mount (istilah kompleks Al Aqsa versi Yahudi) adalah tempat paling penting bagi orang Israel, dan kami menekankan kebebasan bagi Muslim dan Kristen,"" ujar Ben-Gvir.
Kunjungan sekelas menteri ke Al-Aqsa secara provokatif dituding sengaja sebagai upaya kuasai masjid tua itu.
Sebab bagi orang Yahudi, seperti dilansir dariMiddle East Eye, penaklukan Al Aqsa yang mereka sebut Temple Mount sebagai simbol besar, yaitu tanda akhir zaman seperti dinubuatkan dalam kitab suci mereka.
Artinya, dengan merebut Al Aqsa dari tangan kaum muslimin, maka kaum Yahudi sama dengan mendeklarasikan kemenangan.

Bagi mereka, Temple Mount adalah situs tersuci dalam Yudaisme (agama Yahudi). Mereka meyakini pada zaman Romawi kuno, ada dua kuil yang menjadi pusat kerajaan Yahudi di situs tersebut.
Masjid Al Aqsa yang dibangun di era kejayaan Islam diyakini kaum Yahudi berada di atas peninggalan kuil suci mereka.
Satu-satunya bagian yang tersisa dari The Second Temple, adalah Tembok Barat, yang menjadi tempat suci orang Yahudi untuk berdoa.
Atas dasar keyakinan itulah, bagi warga Yahudi, ada kepercayaan bahwa beribadah di dalam Temple Mount dan membangun kembali Kuil Ketiga di situs tersebut, sebagai tanda turunnya Mesias dan Hari Penghakiman.

Namun sikap dan kepercayaan semacam ini justeru menimbulkan konflik dan kekerasan. Warga Yahudi tak segan menyerang dan menerobos ke dalam masjid. Bahkan, penggalian terowongan di bawah masjid sejak 1087 diyakini sebagai bagian dari upaya penguasaan itu.
Padahal posisi masjid bersejarah bagi umat Islam itu diakui sebagai status quo termasuk oleh Israel sendiri sejak 1967. Artinya kontrol atas masjid hanya dilakukan oleh umat Islam."
https://www.cnnindonesia.com/internasional/20250805090215-134-1258779/ma-brasil-vonis-eks-presiden-bolsonaro-jadi-tahanan-rumah;No Title;"Hakim Mahkamah AgungBrasilAlexandre de Moraes mengeluarkan perintah vonis tahanan rumah terhadap eks PresidenJair Bolsonarousai melanggar batasan yang ditetapkan pengadilan, Senin (4/8).
Moraes mengatakan Bolsonaro melanggar pembatasan pengadilan termasuk penggunaan media sosial berisi pesan politik dan telepon seluler.

ADVERTISEMENT
SCROLL TO CONTINUE WITH CONTENT
Hakim itu juga menyebut Bolsonaro merekam pidato dengan menampilkan monitor pergelangan kaki dan akan mengunggah ke akun media sosial pihak ketiga. Menurut Moraes, ini bertentangan dengan perintah pengadilan.
""Bolsonaro telah menyebar pesan dengan konten yang jelas mendorong dan menghasut serangan terhadap Mahkamah Agung dan dukungan terang-terangan terhadap intervensi asing dalam Peradilan Brasil,"" demikian menurut putusan Moraes, dikutipAl Jazeera.
Sebelum putusan ini muncul, Moraes telah membekukan aset anak Bolsonaro, Eduardo, usai diduga menggunakan dana tersebut untuk melobi pemerintahan Donald Trump melawan Brasil.
Bolsonaro sedang diadili karena berbagai tuduhan termasuk upaya membatalkan pemilu 2022. Ia dituding memimpin organisasi kriminal bersenjata, berupaya melakukan kudeta, dan berusaha menghapus aturan hukum secara paksa.




Pada Februari, Bolsonaro didakwa terkait dugaan rencana kudeta untuk membatalkan hasil pemilu 2022 dan mencegah lawannya Luiz Lula da Silva mengambil alih kekuasaan.
Jaksa menduga sebagian rencana itu berpotensi membunuh Lula, wakil presiden, dan menteri Mahkamah Agung. Bolsonaro membantah tuduhan ini.
Putusan hakim ini akan membuat Bolsonaro berada di bawah pengawasan ketat di pergelangan kaki. Ia juga hanya bisa dikunjungi kerabat serta pengacaranya. Semua telepon seluler dari rumahnya juga bakal disita.
Penuntutan Bolsonaro memicu keretakan hubungan Amerika Serikat-Brasil. Pada Juli lalu, Trump memberlakukan tarif impor sebesar 50 persen ke Brasil. Kemudian pekan lalu, pemerintah AS menjatuhkan sanksi ke Moraes."
https://www.cnnindonesia.com/internasional/20250805075121-120-1258753/netanyahu-mau-rebut-total-gaza-ancam-pecat-pejabat-yang-tak-setuju;No Title;"Perdana Menteri IsraelBenjamin Netanyahuberencana memperluas operasi militer untuk menaklukkan secara penuhJalur Gaza, Palestina, dan mengancam pejabat pemerintah untuk mundur jika tidak setuju.
Media IsraelYnetmelaporkan Netanyahu bakal menggelar pertemuan kabinet keamanan pada hari ini, Selasa (5/8). Salah satu pejabat dalam laporan itu mengatakan rapat tersebut untuk mendukung penaklukan Gaza.

ADVERTISEMENT
SCROLL TO CONTINUE WITH CONTENT
""Keputusan sudah bulat, kami akan melakukan penaklukan penuh. Jika Kepala Staf tak setuju, dia harus mundur,"" kata pejabat yang mengetahui masalah tersebut, dikutipCNN, Senin.
Dia mengatakan lembaga pertahanan menentang rencana perluasan operasi militer di area yang diyakini tempat para sandera ditawan.
Hingga kini masih ada 50 sandera yang diyakini berada di Gaza. Sekitar 20 diantaranya dilaporkan masih hidup.
Menteri Luar Negeri Israel, Gideon Sa'ar, membela perluasan operasi militer itu demi keselamatan sandera.
""[Operasi] itu mencerminkan keinginan untuk melihat semua sandera kembali, dan keinginan untuk melihat perang ini berakhir setelah kesepakatan parsial tak berhasil,"" kata Sa'ar saat ditanya soal perluasan operasi Israel.
Namun, rencana perluasan operasi militer Israel ditolak keluarga sandera. Mereka meyakini tindakan tersebut berisiko menempatkan sandera dalam bahaya.




Dalam forum keluarga sandera pada akhir pekan lalu, mereka mewanti-wanti pemerintah tak salah langkah.
""Netanyahu sedang mempersiapkan penipuan terbesar. Klaim berulang soal pembebasan sandera melalui kemenangan militer adalah kebohongan dan penipuan publik,"" demikian pernyataan dalam forum itu.
Mereka menyerukan Israel dan Hamas berkomitmen membawa pulang 50 sandera, mengakhiri perang, dan membangun kembali negara itu.
Keinginan Netanyahu menguasai Gaza sepenuhnya muncul saat negosiasi gencatan berlangsung. Kemauan PM Israel itu tentu menghambat negosiasi.
Di sisi lain, Hamas juga menekankan negosiasi berlanjut jika situasi keamanan yang mengerikan di Gaza segera ditangani.
Pejabat Hamas, Mahmoud Mardawi, mengatakan tak ada gunanya melanjutkan negosiasi selama krisis pangan masih terjadi di Gaza.
Sejak Israel melancarkan agresi ke Palestina, mereka mengawasi secara ketat truk bantuan kemanusiaan yang masuk bahkan sempat menahannya. Imbas tindakan keji ini, banyak warga Gaza kelaparan di tengah agresi brutal mereka.
Dalam beberapa pekan terakhir, ratusan orang meninggal karena kelaparan atau malnutrisi. Selama agresi, lebih dari 60.000 warga Palestina tewas."
https://www.cnnindonesia.com/internasional/20250805073203-124-1258741/video-detik-detik-israel-brutal-tembaki-warga-gaza-yang-antre-bantuan;No Title;"Rekaman menunjukkan kepanikan warga Palestina saat berlarian menghindari rentetan tembakan Israel di dekat lokasi distribusi bantuan Yayasan Kemanusiaan Gaza (GHF) pada Sabtu (2/8).
Seorang anak terekam berlari ke arah kerumunan tepat saat suara tembakan terdengar.
Dalam video, warga juga terlihat merunduk di tanah ketika peluru menghantam gundukan di dekat mereka.
Menurut PBB, lebih dari 1.000 orang telah tewas saat mencoba mendapatkan bantuan di Gaza sejak GHF mulai beroperasi pada Mei 2025."
https://www.cnnindonesia.com/internasional/20250805070459-134-1258750/as-selidiki-pejabat-kabinet-obama-soal-pencemaran-nama-baik-trump;No Title;"Jaksa AgungAmerika Serikat, Pam Bondi, dilaporkan telah menginstruksikan jaksa federal untuk memulai penyelidikan melalui dewan juri(grand jury)terhadap sejumlah pejabat pemerintahan PresidenBarack Obama.
Penyelidikan ini terkait tuduhan bahwa sejumlah pejabat kabinet Obama memanipulasi intelijen terkait campur tangan Rusia dalam pemilu 2016 dan berupaya mencemarkan nama baik Donald Trump lewat tuduhan tersebut.

ADVERTISEMENT
SCROLL TO CONTINUE WITH CONTENT
Fox Newsyang pertama melaporkan kabar penyelidikan ini. Sementara itu,CNNmelaporkan penyelidikan grand jury memungkinkan dikeluarkannya surat panggilan(subpoena)sebagai bagian dari proses hukum pidana terhadap sejumlah pejabat Partai Demokrat.
Dewan juri juga dapat mempertimbangkan untuk mengeluarkan dakwaan apabila Departemen Kehakiman (DOJ) memutuskan membawa perkara ini ke ranah pidana.
DikutipCNN, penyelidikan ini dilakukan setelah muncul rekomendasi resmi dari Direktur Intelijen Nasional (DNI), Tulsi Gabbard, yang pada Juli lalu membuka dokumen rahasia yang menurutnya melemahkan kesimpulan pemerintahan Obama bahwa Rusia berusaha membantu kemenangan Trump atas Hillary Clinton.
Gabbard mendeklasifikasi sejumlah intelijen pada Juli lalu yang dianggap memperlihatkan sudut pandang baru atas dugaan keputusan pemerintahan Obama bahwa Rusia berusaha membantu kemenangan Trump dalam pemilu 2016.
Dalam konferensi pers, Gabbard menuding bahwa mantan Presiden Barack Obama dan pejabat intelijennya mendorong ""narasi yang direkayasa"" bahwa Rusia ikut campur dalam pemilu untuk membantu Trump menang, dan menjual narasi tersebut kepada publik seolah-olah sebagai fakta.
""Padahal tidak demikian,"" kata Gabbard dalam jumpa pers saat itu.




Salah satu dokumen yang dideklasifikasi adalah catatan pertemuan yang menunjukkan bahwa Obama diduga meminta para deputinya untuk menyusun penilaian intelijen pada Desember 2016-setelah Trump menang-yang merinci ""alat dan tindakan yang digunakan Moskow untuk mempengaruhi hasil pemilu 2016.""
Penilaian intelijen tersebut menekankan bahwa tindakan Rusia tidak mempengaruhi hasil pemilu, namun bertujuan untuk menanamkan ketidakpercayaan terhadap proses demokrasi.
Tak lama setelah rekomendasi tersebut disampaikan, Bondi mengumumkan bahwa Kementerian Kehakiman membentuk sebuah ""gugus tugas khusus"" untuk mengevaluasi bukti-bukti yang dirilis Gabbard.
Bondi juga meminta Kementerian Kehakiman ""menyelidiki langkah hukum selanjutnya yang mungkin diperlukan berdasarkan pengungkapan dari DNI Gabbard.""
Dalam surat yang ditinjau olehFox News Digital,Pam Bondi secara pribadi memerintahkan seorang jaksa federal untuk memulai proses hukum dan mempresentasikan bukti kepada dewan juri.
Juru bicara DOJ menolak berkomentar terkait penyelidikan ini, namun menegaskan bahwa Bondi memandang serius menanggapi rekomendasi dari Gabbard. Ia menyatakan bahwa Bondi menilai terdapat ""alasan kuat untuk kekhawatiran mendalam"" dan bahwa langkah-langkah hukum selanjutnya perlu dipertimbangkan.
Namun,CNNsebelumnya melaporkan bahwa tuduhan yang disampaikan Gabbard keliru menggambarkan kesimpulan komunitas intelijen mengenai upaya Rusia mempengaruhi pemilu 2016."
https://www.cnnindonesia.com/internasional/20250804204421-134-1258661/mengenal-helsing-perusahaan-ai-yang-dipakai-israel-serang-gaza;No Title;"Sejumlah musisi internasional ramai-ramai memboikot platform streaming Spotify usai CEO-nya, Daniel Ek, berinvestasi besar di Helsing, perusahaan teknologi kecerdasan buatan (AI) yang digunakan dalam serangan militer, termasuk diJalur Gaza,Palestina.
Helsing adalah perusahaan teknologi pertahanan berbasis di Eropa yang didirikan pada 2021.

ADVERTISEMENT
SCROLL TO CONTINUE WITH CONTENT
Perusahaan ini mengembangkan perangkat lunak berbasis AI untuk menganalisis data sensor dan sistem persenjataan dalam jumlah besar di medan perang.
Teknologi ini membantu militer mengambil keputusan secara real-time saat melakukan operasi tempur.
Selain perangkat lunak, Helsing juga memproduksi perangkat keras militer seperti drone HX-2. Perusahaan ini mengklaim memiliki misi untuk ""melindungi nilai-nilai demokrasi dan masyarakat terbuka"".

Namun, di tengah agresi militer Israel di Gaza yang menewaskan ribuan warga sipil, keterlibatan Helsing dalam pengembangan sistem tempur berbasis AI mendapatkan kecaman dari sejumlah musisi.
Mereka menilai keberadaan perusahaan seperti Helsing justru memperburuk eskalasi konflik bersenjata dan meningkatkan efektivitas serangan mematikan.
Salah satu yang vokal menyuarakan protes adalah Greg Saunier, pendiri band Deerhoof, yang menyatakan bahwa bandnya menarik semua karya dari Spotify sebagai bentuk penolakan terhadap keterlibatan platform tersebut dalam industri senjata.

""Setiap kali seseorang mendengarkan musik kami di Spotify, apakah itu berarti ada satu dolar lagi yang disedot untuk membuat semua yang telah kami saksikan di Gaza jadi lebih sering dan menguntungkan?"" kata Saunier kepadaThe Los Angeles Times.
Aksi boikot juga dilakukan oleh band-band lain seperti Xiu Xiu, label elektronik asal Amsterdam Kalahari Oyster Cult, dan band rock asal Australia King Gizzard & the Lizard Wizard.
""Saya tidak menganggap diri saya seorang aktivis, ini seperti keputusan untuk tetap setia pada diri sendiri,"" ujar vokalis King Gizzard & the Lizard Wizard, Stu Mackenzie.
""Kami menyadari bahwa kami tidak ingin musik kami ada disana saat ini.""
Daniel Ek, yang juga pendiri Spotify, diketahui memimpin putaran pendanaan Helsing pada Juni 2025 sebesar US$700 juta (sekitar Rp11,4 triliun) melalui perusahaan modal ventura miliknya, Prima Materia. Ek juga menjabat sebagai ketua dewan Helsing.

Investasi tersebut dinilai banyak musisi sebagai bentuk pengalihan keuntungan dari karya seni ke industri militer. Mereka menilai hal ini bertentangan dengan semangat musik sebagai sarana ekspresi damai.
Tak hanya soal etika, para musisi juga sejak lama mengkritik Spotify karena memberikan royalti yang sangat rendah, sehingga investasi besar ke perusahaan militer seperti Helsing dianggap sebagai bentuk pengabaian terhadap kesejahteraan seniman."
https://www.cnnindonesia.com/internasional/20250805063704-113-1258724/israel-perluas-agresi-gaza-sampai-media-asing-soroti-bendera-one-piece;No Title;"Agresi brutal Israel ke Jalur GazaPalestinahingga media asing soroti polemik bendera animeOne Piecejelang HUT RI ke-80 menjadi sorotan berita internasional pada Senin (4/8).
Berikut kilas berita internasional:
Perdana Menteri (PM) Israel Benjamin Netanyahu bakal menggelar pertemuan kabinet pada Selasa (5/8) ini.
ADVERTISEMENT
SCROLL TO CONTINUE WITH CONTENT
AFPmemberitakan, seorang pejabat di kantor PM Israel--dikutip dari Channel 12 dan Jerusalem Post-- menyatakan Netanyahu cenderung memperluas serangan di Gaza, Palestina, dan merebut seluruh wilayah kantong tersebut dengan dalih upaya pembebasan sandera.
Netanyahu disebut akan menggunakan kebuntuan negosiasi dengan kelompok faksi milisi Hamas di Gaza untuk memperluas operasi militer ke wilayah tersebut. Disebutkan saat ini setidaknya ada sekitar 20 sandera yang masih hidup masih ditahan Hamas.

Hampir 50 tentara Israel dilaporkan bunuh diri sejak Tel Aviv melancarkan agresi brutalnya ke Jalur Gaza Palestina pada Oktober 2023.
HarianHaaretzmelaporkan ada 17 tentara bunuh diri sepanjang 2025 ini, sementara 24 kasus lainnya terjadi pada 2024, dan 17 kasus pada 2023, termasuk tujuh tentara yang bunuh diri setelah pecahnya agresi di Gaza.
Koran tersebut menyebutkan bahwa kekurangan tenaga profesional kesehatan mental di militer, termasuk layanan psikiater, psikolog, dan pekerja sosial-menjadi salah satu faktor yang berkontribusi terhadap kasus-kasus bunuh diri tersebut.




Menjelang peringatan Hari Ulang Tahun ke-80 Republik Indonesia, bendera bajak laut dari serial anime Jepang One Piece menjadi sorotan publik, bahkan menarik perhatian sejumlah media internasional.
Bendera tersebut, yang dikenal sebagai Jolly Roger milik kelompok Straw Hat Pirates, dikibarkan oleh sejumlah warga Indonesia di rumah, kendaraan, hingga area publik sebagai bentuk simbolik dari protes sosial dan politik.
Fenomena ini memicu polemik. Pemerintah Indonesia, melalui sejumlah pejabat tinggi negara, menyuarakan kekhawatiran bahwa tren tersebut bisa memicu perpecahan persatuan nasional, bahkan dianggap sebagai bentuk ketidaktundukan simbolik."
