title;url;content
Gibran Tanggapi Usulan DPR soal Gerbong Perokok: Mohon Maaf, Ada Hal Lain Lebih Prioritas;https://www.liputan6.com/news/read/6140872/gibran-tanggapi-usulan-dpr-soal-gerbong-perokok-mohon-maaf-ada-hal-lain-lebih-prioritas;Liputan6.com, Jakarta - Wakil Presiden Gibran Rakabuming Raka menilai ruang laktasi atau ibu menyusui dan ruang ganti popok untuk bayi lebih prioritas dalam perjalanan kereta jarak jauh. Pernyataan Gibran tersebut menanggapi usulan dari salah satu anggota legislatif yang menilai perlunya gerbong khusus perokok untuk perjalanan kereta jarak jauh. Baca Juga “Jika ada ruang fiskal, kalau pendapat saya pribadi, lebih baik diprioritaskan untuk misalnya ibu hamil, ibu menyusui, balita, lansia, kaum difabel,” kata Wapres Gibran usai meninjau revitalisasi Stasiun Solo Balapan di Solo, Jawa Tengah, Minggu (24/8) seperti dilansir Antara. Advertisement Gibran menilai bahwa dalam sebuah perumusan kebijakan yang menyangkut masyarakat, harus ditentukan terlebih dahulu skala prioritas sesuai kebutuhan. Menurut Gibran, jika ada ruang fiskal yang dapat dianggarkan oleh PT KAI, lebih baik diprioritaskan untuk ibu hamil, ibu menyusui, lansia, hingga kaum difabel. “Misalnya ada ruang laktasi di gerbongnya, mungkin toiletnya, kamar mandinya bisa dilebarkan sehingga ibu-ibu bisa mengganti popok bayi dengan lebih nyaman. Saya kira itu lebih prioritas. Sekali lagi, dalam perumusan sebuah kebijakan ada skala prioritasnya,” kata Gibran. 
Sosok dan Sepak Terjang Irvian yang Dijuluki 'Sultan' Kemnaker oleh Immanuel Ebenezer;https://www.liputan6.com/news/read/6141084/sosok-dan-sepak-terjang-irvian-yang-dijuluki-sultan-kemnaker-oleh-immanuel-ebenezer;"Liputan6.com, Jakarta - Sosok Irvian Bobby Mahendro atau IBM kini tengah menjadi sorotan publik. Bukan hanya karena keterlibatannya dalam kasus pemerasan di Kemenaker, tetapi juga karena julukan yang disematkan kepadanya sebagai 'Sultan' Kemenaker. Diketahui, Irvian merupakan salah satu dari 11 tersangka dalam dugaan pemerasan terkait pengurusan sertifikat keselamatan dan kesehatan kerja (K3) di lingkungan Kemenaker, yang melibatkan Immanuel Ebenezer Gerungan (IEG) atau 'Noel' selaku Wakil Menteri Ketenagakerjaan. Baca Juga Menurut Ketua Komisi Pemberantasan Korupsi (KPK) Setyo Budiyanto, julukan 'Sultan' hanya disematkan kepada Irvian (IBM) dari 11 tersangka yang terlibat. Advertisement “Hanya IBM,” ujar Setyo di Jakarta, Sabtu 24 Agustus 2025. Setyo menjelaskan, julukan tersebut diberikan IEG karena Irvian dinilai sebagai sosok yang memiliki banyak uang di Direktorat Jenderal Pembinaan dan Pengawasan Ketenagakerjaan serta K3 Kemenaker. ""IEG menyebut IBM sebagai ‘Sultan’, maksudnya orang yang banyak uang di Ditjen Binwasnaker dan K3,” jelasnya. Berkat julukan itu, Noel pun meminta uang sebesar Rp3 miliar kepada Irvian, yang disanggupi dengan alasan dana tersebut akan digunakan untuk merenovasi rumahnya. ""IEG minta untuk renovasi rumah Cimanggis, IBM kasih Rp3 miliar,"" ungkap Setyo. Selain uang, ada permintaan motor Ducati yang diminta Noel, motor tersebut dibeli secara off the road, dan sampai dengan saat ini belum dilakukan proses pengurusan BPKB maupun STNK. Diduga, upaya ini dilakukan agar asal uang tersebut tak terendus, apalagi dipasangkan plat kosong atau didapat dengan cara ilegal. ""Rp3 miliar dan motor, motornya Ducati ya,"" ucap Plt Deputi Penindakan dan Eksekusi KPK Asep Guntur."
Begini Tampang 4 Aktor Intelektual Penculikan dan Pembunuhan Kepala Cabang Bank di Jakarta;https://www.liputan6.com/news/read/6141013/begini-tampang-4-aktor-intelektual-penculikan-dan-pembunuhan-kepala-cabang-bank-di-jakarta;"Liputan6.com, Jakarta - Polisi berhasil meringkus empat aktor intelektual atau dalang dari insiden penculikan disertai pembunuhan terhadap kepala cabang bank di Jakarta berinisial IP. Empat Pelaku tersebut ditangkap di hari dan waktu yang berbeda-beda. Tiga pelaku, DH, YJ dan AA ditangkap pada tanggal 23 Agustus 2025 pukul 20.15 WIB, di daerah Solo, Jawa Tengah. Sedangkan C ditangkap pada di daerah PIK, Jakarta Utara pukul 15.30 WIB pada 24 Agustus 2025 Baca Juga ""Yang benar, (aktor intelektual) sudah ditangkap,"" kata Kasubdit Jatanras Polda Metro Jaya (PMJ), AKBP Abdul Rahim kepada awak media, Minggu (24/8/2025). Advertisement Berdasarkan foto yang diterima Liputan6.com, tiga pelaku terlihat berada di dalam mobil dengan tangan diborgol, sedangkan satu pelaku lainnya sudah dibawa ke kantor Tim Jatanras Polda Metro Jaya setelah ditangkap. Sebelumnya diberitakan, Polisi menangkap tiga pelaku penculikan kepala cabang bank di Jakarta berinisial IP di pusat perbelanjaan di Ciracas, Jakarta Timur pada Kamis (21/8/2025). Sebanyak 3 pelaku penculikan ditangkap di daerah Johar Baru, Jakarta Pusat. Sementara, satu pelaku lain diamankan di Nusa Tenggara Timur saat melarikan diri. "
Komplotan Penculik Hingga Otak Pembunuhan Kepala Cabang Bank Sudah Ditangkap, Motif Segera Terungkap;https://www.liputan6.com/news/read/6141056/komplotan-penculik-hingga-otak-pembunuhan-kepala-cabang-bank-sudah-ditangkap-motif-segera-terungkap;"Liputan6.com, Jakarta - Komplotan pelaku penculikan dan pembunuhan kepala cabang bank BUMN di Jakarta berinisiap IP satu per satu mulai terungkap. Terbaru, polisi menangkap aktor intelektual dari pembunuhan IP yang berjumlah empat orang. Keempat pelaku ditangkap di hari dan waktu yang berbeda-beda. Di antaranya tiga pelaku yakni DH, YJ dan AA dibekuk di Solo, Jawa Tengah, dan C ditangkap di daerah Pantai Indah Kapuk (PIK) Jakarta Utara. Baca Juga ""Yang benar, (aktor intelektual) sudah ditangkap,"" kata Kasubdit Jatanras Polda Metro Jaya (PMJ) AKBP Abdul Rahim kepada awak media, Minggu (24/8/2025). Advertisement Sebelum keempat otak pembunuhan sadis ini, polisi telah menangkap empat pelaku penculikan kepala cabang bank pelat merah tersebut. Polisi sedang melakukan pemeriksaan intensif kepada para pelaku untuk mengungkap lebih jauh terkait peran dan motif pembunuhan kepala cabang bank tersebut. ""Saat ini para tersangka sedang dilakukan pendalaman secara intensif,"" ungkap Abdul."
UI Minta Maaf usai Heboh Undang Profesor Pro Israel jadi Pembicara;https://www.liputan6.com/news/read/6140944/ui-minta-maaf-usai-heboh-undang-profesor-pro-israel-jadi-pembicara;"Liputan6.com, Jakarta - Universitas Indonesia (UI) menyampaikan permohonan maaf setelah mengundang Prof Peter Berkowitz dari The Hoover Institutions - University of Stanford pada kegiatan Pengenalan Sistem Akademik Universitas (PSAU) Pascasarjana UI. Berkowitz merupakan salah satu tokoh cendekia yang aktif menyuarakan dukungannya terhadap Israel. Ia juga diketahui sebagai tokoh yang telah menulis banyak artikel yang mendukung genosida di Palestina. Baca Juga Hal ini memicu reaksi dari warganet, sebab mereka umumnya tidak percaya bahwa institusi pendidikan tertua di Indonesia tersebut tidak melakukan pengecekan latar belakang tamu yang diundang. Advertisement ""Dengan segala kerendahan hati UI mengakui kurang hati-hati, dan untuk itu UI meminta maaf yang sebesar-besarnya kepada seluruh rakyat Indonesia atas kekhilafan dalam kekurangcermatan saat melakukan background check terhadap yang bersangkutan,"" kata Direktur Humas, Media, Pemerintah, dan Internasional UI Arie Afriansyah dikonfirmasi di Jakarta, Minggu (24/8/2025) Arie menegaskan tidak ada maksud lain dalam memberikan kesempatan kepada tokoh tersebut dalam berorasi selain untuk kepentingan akademik."
Gerindra Bakal Cabut Kenggotaan Immanuel Ebenezer Usai Jadi Tersangka KPK;https://www.liputan6.com/news/read/6141600/gerindra-bakal-cabut-kenggotaan-immanuel-ebenezer-usai-jadi-tersangka-kpk;"Liputan6.com, Jakarta - Sekretaris Jenderal atau Sekjen Partai Gerindra Sugiono menyampaikan status keanggotaan mantan Wakil Menteri Ketenagakerjaan (Wamenaker) Immanuel Ebenezer alias Noel di Gerindra. Hal ini menyusul Komisi Pemberantasan Korupsi (KPK) yang menetapkan Wamenaker Immanuel Ebenezer alias Noel sebagai kasus dugaan pemerasan pengurusan sertifikasi keselamatan dan kesehatan kerja (K3). Baca Juga ""Dicabut keanggotaannya, dicabut Kartu Tanda Anggota (KTA)nya,"" ujar Sugiono di Istana Negara Jakarta, Senin (25/8/2025). Advertisement Dia menjelaskan Noel masih berstatus anggota, bukan kader. Sebab untuk menjadi kader di Partai Gerindra, mereka diwajibkan melewati proses kaderisasi. ""Jadi gini, di Gerindra itu ada yang namanya anggota, ada yang namanya kader. Kader ini syaratnya adalah mereka yang melewati suatu proses kaderisasi ada beberapa tingkatan,"" ucap Sugiono. Sementara itu, lanjut dia, Noel belum pernah mengikuti kaderisasi di Partai Gerindra. Menurut dia, Noel menjadi anggota Partai Gerindra sebagai syarat untuk maju di pemilihan legislatif (Pileg) 2024. ""Sepanjang ingatan saya Pak Noel itu belum pernah mengikuti kaderisasi di Gerindra. Tapi sebagai persyaratan pencalegan di tahun 2024 ada kewajiban untuk menjadi anggota Gerindra,"" tutur Sugiono. Menteri Luar Negeri itu menuturkan Gerindra mengevaluasi keanggotaan Noel usai menjadi tersangka KPK. Dia memastikan Gerindra secepatnya mencabut KTA Noel. ""Proses yang akan kami lakukan tentu saja akan mengevaluasi keanggotaan tersebut dan kalau misalnya memang sudah kemarin kan sempat udah tersangka ya, sudah diberhentikan juga sebagai anggota kabinet, saya kira proses di partai juga akan segera menyusul,"" ujar Sugiono. "
Trik Immanuel Ebenezer Minta Rp3 Miliar dan Motor Ducati dari 'Sultan' Kemnaker;https://www.liputan6.com/news/read/6141601/trik-immanuel-ebenezer-minta-rp3-miliar-dan-motor-ducati-dari-sultan-kemnaker;"Liputan6.com, Jakarta - Wamenaker Immanuel Ebenezer alias Noel disebut telah meminta uang sebanyak Rp3 Miliar terkait kasus pemerasan untuk penerbitan sertifikasi Keselamatan dan Kesehatan Kerja (K3) dari kepada tersangka Irvian Bobby Mahendro (IBM). Sosok Irvian ini dianggap Noel sebagai sultan di Kemnaker lantaran punya banyak uang. KPK menyebut, Irvian diduga menjadi tersangka yang menerima aliran dana terbanyak kasus tersebut sebesar Rp69 miliar. Baca Juga ""IEG menyebut IBM sebagai sultan, maksudnya orang yang banyak uang di Ditjen Binwas K3,"" kata Setyo kepada wartawan, Sabtu (23/8/2025). Advertisement Dari sana lah, Noel pun meminta uang Rp3 miliar kepada Irvian untuk merenovasi rumahnya di Cimanggis, Depok, Jawa Barat. Irvian menyanggupi duit yang diminta Noel tersebut. ""EG minta untuk renovasi rumah Cimanggis, IBM kasih Rp3 miliar,"" ungkap Setyo."
Diberi Bintang Kehormatan, Ini Jejak Haji Isam Ikut Bertemu Tokoh Penting Hingga Diberi Tugas oleh Prabowo;https://www.liputan6.com/news/read/6141598/diberi-bintang-kehormatan-ini-jejak-haji-isam-ikut-bertemu-tokoh-penting-hingga-diberi-tugas-oleh-prabowo;Liputan6.com, Jakarta Presiden Prabowo Subianto menganugerahkan bintang kehormatan kepada tokoh yang dinilai berjasa bagi bangsa dan negara di Istana Negara Jakarta, Senin (25/8/2025). Salah satunya Andi Syamsuddin Arsyad atau yang lebih dikenal Haji Isam. Sebanyak 117 penerima bintang kehormatan terdiri dari berbagai latar belakang mulai dari, menteri, wakil menteri, pimpinan lembaga tinggi negara, kepala badan, ketua umum partai politik, purnawirawan TNI, pengusaha, hingga penyanyi. Baca Juga Andi Syamsuddin Arsyad atau yang lebih dikenal Haji Isam mendapat Bintang Mahaputera Utama karena dinilai berjasa luar biasa dalam mendorong pertumbuhan ekonomi daerah maupun nasional. Dia membangun kiprah bisnis terutama di bidang pertambangan, batubara, transportasi dan infrastruktur yang membuka banyak lapangan pekerjaan. Advertisement Haji Isam beberapa kali diundang ke Istana dan mendampingi Presiden Prabowo Subianto. Berikut catatan yang dirangkum Liputan6.com.
HUT ke-27 PAN, Zulhas Puji Prabowo Satu-satunya Presiden yang Berani Terapkan Pasal 33 UUD 1945;https://www.liputan6.com/news/read/6141072/hut-ke-27-pan-zulhas-puji-prabowo-satu-satunya-presiden-yang-berani-terapkan-pasal-33-uud-1945;"Liputan6.com, Jakarta - Ketua Umum Partai Amanat Nasional (PAN) Zulkifli Hasan (Zulhas) memuji langkah Presiden Prabowo Subianto dalam menerapkan prinsip Pasal 33 UUD 1945. Yaitu dengan mengedepankan ekonomi gotong royong dan pemerataan. Hal itu disampaikan Zulhas saat memberikan sambutan dalam peringatan HUT ke-27 PAN, di Jakarta, Minggu (24/8/2025) malam. Baca Juga ""Saudara-saudara, kita punya Presiden Pak Prabowo Subianto, satu-satunya presiden yang berani menerapkan Pasal 33, pemberdayaan, pemerataan, gotong royong, ekonomi Pancasila,"" kata Zulhas. Advertisement Menurutnya, kebijakan yang diambil Prabowo sejalan dengan cita-cita PAN dalam memperjuangkan keadilan sosial dan pemberdayaan masyarakat. ""Nah itulah yang Partai Amanat Nasional perjuangkan hari-hari ini dan hari yang akan datang,"" ujarnya. Zulhas menyebut, semangat ekonomi Pancasila yang dijalankan Prabowo harus terus didukung agar mampu menghadirkan pemerataan kesejahteraan bagi seluruh rakyat Indonesia. Adapun, Pasal 33 UUD 1945 merupakan landasan perekonomian Indonesia yang menekankan prinsip demokrasi ekonomi dengan asas kekeluargaan dan gotong royong. "
Prabowo Sambangi Kediaman Ma’ruf Amin, Cium Tangan Lalu Diskusi Bahas Pembangunan RI;https://www.liputan6.com/news/read/6140951/prabowo-sambangi-kediaman-maruf-amin-cium-tangan-lalu-diskusi-bahas-pembangunan-ri;"Liputan6.com, Jakarta - Presiden Prabowo Subianto menyambangi kediaman Wakil Presiden Republik Indonesia ke-13, K.H. Ma’ruf Amin di Depok, Jawa Barat, hari ini. Tampak dalam kunjungan tersebut, kepala negara menunduk dan mencium tangan sang kiai. Mengutip informasi yang dipublikasi sosial media resmi presiden, kunjungan itu menjadi bentuk silaturahmi dengan tujuan mempererat tali persaudaraan. Baca Juga ""Presiden menyambangi dalam rangka silaturahmi dan mempererat tali persaudaraan,"" tulis Tim Media Prabowo Subianto seperti dikutip Minggu (24/8/2025). Advertisement Dalam kunjungannya, Prabowo disebut berdiskusi dan bertukar pikiran dengan Ma'ruf Amin perihal pembangunan bangsa. ""Kedua pemimpin berdiskusi dan bertukar pikiran mengenai arah pembangunan bangsa ke depan,"" jelas keterangan tersebut. Prabowo berharap, kunjungan itu diartikan hubungan baik antar pemimpin Republik Indonesia dari masa ke masa. ""Kunjungan ini juga mencerminkan kehangatan hubungan antar pemimpin bangsa serta menegaskan semangat persatuan yang senantiasa menjadi landasan kokoh dalam perjalanan Indonesia,"" dia menandasi. "
Survei: Abolisi dan Amnesti Tak Guncang Hubungan Prabowo-Jokowi;https://www.liputan6.com/news/read/6140838/survei-abolisi-dan-amnesti-tak-guncang-hubungan-prabowo-jokowi;Liputan6.com, Jakarta - Hasil survei nasional Polling Institute menunjukkan mayoritas publik tidak percaya bahwa hubungan Presiden Prabowo Subianto dengan Presiden ke-7 RI, Joko Widodo (Jokowi), retak usai kebijakan pemberian abolisi dan amnesti kepada Tom Lembong dan Hasto Kristiyanto. Dalam survei yang digelar pada 4–7 Agustus 2025 itu, sebanyak 52,1 persen responden menyatakan tidak percaya (28,3 persen kurang percaya dan 23,8 persen tidak percaya sama sekali) terhadap anggapan bahwa hubungan Prabowo–Jokowi tidak harmonis pasca kebijakan tersebut. Baca Juga Sementara itu, yang menyatakan percaya hanya 23,2 persen (3,6 persen sangat percaya dan 19,6 persen cukup percaya). Adapun sisanya, 24,8 persen, memilih tidak tahu atau tidak menjawab. Advertisement “Temuan ini mengindikasikan bahwa publik melihat hubungan Prabowo dan Jokowi relatif stabil, meskipun muncul kebijakan yang berpotensi menimbulkan tafsir politik seperti pemberian abolisi dan amnesti,” ujar Kennedy Muslim, Peneliti Utama Polling Institute, saat memaparkan rilis survei bertajuk ‘Tingkat Kepercayaan Publik Terhadap Lembaga Negara dan Isu-Isu Politik Terkini’ secara virtual, Minggu (24/8). Menurut Kennedy, mayoritas publik menilai kebijakan Prabowo tersebut lebih sebagai langkah politik yang berorientasi pada rekonsiliasi, bukan pemicu disharmoni. “Responden cenderung menilai keputusan Presiden justru memperluas ruang politik inklusif, sehingga isu retaknya hubungan Prabowo–Jokowi tidak terlalu dipercaya,” jelasnya. 
Wacana Pangkas Trotoar Atasi Macet Horor TB Simatupang Tuai Kritik, Ini Penjelasan Gubernur Pramono;https://www.liputan6.com/news/read/6141578/wacana-pangkas-trotoar-atasi-macet-horor-tb-simatupang-tuai-kritik-ini-penjelasan-gubernur-pramono;Liputan6.com, Jakarta Gubernur DKI Jakarta Pramono Anung menyebut bahwa Pemprov DKI Jakarta sedang melakukan langkah strategis untuk mengatasi kemacetan di kawasan TB Simatupang, Jakarta Selatan. Salah satu upaya yang dilakukan untuk mengatasi kemacetan tersebut dengan memanfaatkan trotoar yang sementara tidak digunakan akibat proyek pembangunan serta menambah armada Transjakarta di rute tersebut. Baca Juga “Berkaitan dengan pembenahan persoalan kemacetan di TB Simatupang, saya ingin meluruskan agar tidak terjadi kesalahpahaman. Trotoar yang dimaksud bukan trotoar yang sedang dipakai pejalan kaki, melainkan trotoar yang memang tidak dapat digunakan karena ada proyek di sana,” kata Pramono di Cakung, Jakarta Timur, Senin (25/8/2025). Advertisement
Dasco Tanggapi Demo di DPR: Kita Akan Terima dan Lakukan Introspeksi ke Dalam;https://www.liputan6.com/news/read/6141613/dasco-tanggapi-demo-di-dpr-kita-akan-terima-dan-lakukan-introspeksi-ke-dalam;"Liputan6.com, Jakarta - Wakil Ketua DPR RI Sufmi Dasco Ahmad meminta pendemo yang melakukan unjuk rasa di Gedung DPR RI, Senin (25/8/2025) untuk tertib dan tak melanggar aturan dalam menyampaikan aspirasi maupun pendapat. Dia mengatakan DPR menerima aspirasi yang disampaikan dan akan melakukan introspeksi ke dalam. ""Pada dasarnya kita menghormati hak untuk berserikat, berkumpul dan menyatakan pendapat dan tentunya menyuarakan aspirasi kepada DPR RI. Kita akan terima dengan baik dan kita akan lakukan introspeksi-introspeksi ke dalam,"" jelas Dasco di Istana Negara Jakarta, Senin (25/8/2025) Baca Juga ""Namun kami imbau kepada para masyarakat ataupun adik-adik yang menunjukkan aspirasi kepada negara agar tertib melalui aturan yang berlaku,"" sambungnya. Advertisement Dia mengaku sudah meminta anggota DPR untuk menemui pendemo. Sebab, Dasco saat ini memiliki kegiatan di Istana Negara untuk menerima tanda kehormatan dari Presiden Prabowo Subianto. ""Saya kebetulan disini kita sudah delegasikan kepada kawan-kawan yang stand by di DPR demikian,"" ujar Dasco. "
Mantan Kepala Dishub DKI Era Jokowi-Ahok Udar Pristono Meninggal Dunia;https://www.liputan6.com/news/read/6141547/mantan-kepala-dishub-dki-era-jokowi-ahok-udar-pristono-meninggal-dunia;Liputan6.com, Jakarta - Kabar duka datang dari dunia perhubungan. Mantan Kepala Dinas Perhubungan (Dishub) DKI Jakarta, Udar Pristono, meninggal dunia pada Senin, (25/8/2025) pukul 08.02 WIB. Jenazah almarhum akan disemayamkan di rumah duka Komplek Liga Mas Blok F No. 6, Duren Tiga, Pancoran, Jakarta Selatan. “Innalillahi wa inna ilaihi raji’un. Telah berpulang ke Rahmatullah, suami/ayah kami tercinta: Udar Pristono bin Soebardi pada hari Senin, 25 Agustus 2025 pukul 08.02 WIB,” dalam keterangan diterima, Senin (25/8/2025). Advertisement Prosesi pemakaman akan dilaksanakan pada Senin sore, 25 Agustus 2025, setelah salat Ashar, di TPU Tanah Kusir, Jakarta Selatan, tepatnya Blok AAI-Petak 001, Blad 171, Unit Islam. Pihak keluarga memohon doa dan keikhlasan agar almarhum diampuni segala dosa, diterima amal ibadahnya, dan ditempatkan di surga-Nya. “Mohon dimaafkan segala kesalahan beliau semasa hidupnya,” katanya. 
Prabowo Lantik Kepala Badan Industri Mineral dan Kepala Badan Otorita Pengelola Pantura Jawa, Ini Sosoknya;https://www.liputan6.com/news/read/6141449/prabowo-lantik-kepala-badan-industri-mineral-dan-kepala-badan-otorita-pengelola-pantura-jawa-ini-sosoknya;Liputan6.com, Jakarta Presiden Prabowo Subianto melantik Brian Yuliarto sebagai Kepala Badan Industri Mineral di Istana Negara Jakarta, Senin (25/8/2025). Brian saat ini menjabat sebagai Menteri Pendidikan Tinggi, Sains, dan Teknologi (Mendiktisaintek). Pelantikan berdasarkan pada Keputusan Presiden (Keppres) Republik Indonesia Nomor 77/P Tahun 2025 tentang tentang Pengangkatan Kepala Badan Industri Mineral.
Demo di Gedung DPR, Beton di Depan Gerbang Utama Berlumur Oli;https://www.liputan6.com/news/read/6141434/demo-di-gedung-dpr-beton-di-depan-gerbang-utama-berlumur-oli;"Liputan6.com, Jakarta Beton yang terpasang di gerbang utama Gedung DPR/MPR RI berlumur oli. Pantauan di lokasi, oli tersebut merata dan juga terdapat lem aibon di sekitar tiang pagarnya. Belum diketahui siapa yang melakukan hal tersebut. Pantauan sejak pagi hari, oli tersebut sudah ada melumuri pagar beton. Baca Juga Menanggapi hal itu, Kapolres Metro Jakarta Pusat, Kombes Pol Susatyo Purnomo Condro mengaku tidak tahu. Menurut dia, tugas anggotanya hanya pengamanan dan tidak terkait soal oli dan aibon. Advertisement ""Tidak ada kaitan oli-olian. Kami pengamanan saja,"" kata Kapolres Metro Jakarta Pusat, Kombes Pol Susatyo Purnomo Condro saat dikonfirmasi, Senin (25/8/2025)."
Detik-Detik Tertangkapnya 'Kapten' dari Komplotan Penculik dan Otak Pembunuhan Kepala Cabang Bank;https://www.liputan6.com/news/read/6141436/detik-detik-tertangkapnya-kapten-dari-komplotan-penculik-dan-otak-pembunuhan-kepala-cabang-bank;"Liputan6.com, Jakarta Polisi menangkap pria berinisial EW yang diduga sebagai 'kapten' penculikan Kepala Cabang bank di Jakarta. Penangkapan ini dilakukan di Bandara Komodo Labuan Bajo, Nusa Tenggara Timur (NTT). ""Akhir sang kapten penculikan Kepala Cabang BRI Cempaka Putih, Jakarta Pusat. EW ditangkap saat tiba di Bandara Komodo Labuan Bajo NTT, oleh team gabungan Ditreskrimum Polda Metro Jaya dan Satreskrim Polres Mabar Polda NTT,"" tulis dalam caption pada video yang diunggah akun @jacklyn_choppers seperti dikutip merdeka.com, Senin (25/8). Baca Juga Dalam video itu, terduga pelaku terlihat mengenakan topi hingga kaos berwarna hitam. Pada video tersebut dirinya tengah diinterogasi atau diminta keterangan oleh petugas. Advertisement Selanjutnya, terduga pelaku langsung dibawa petugas dengan menggunakan mobil ke bandara untuk diterbangkan ke Jakarta. Terduga pelaku dikawal ketat polisi menggunakan pesawat Batik Air terbang ke Jakarta. Setibanya di Polda Metro Jaya, terduga pelaku tangannya diikat itu terlihat tertunduk lesu sambil berjalan dengan pelaku lainnya menuju ke gedung Ditreskrimum."
Dilantik Prabowo, Eddy Hartono Kembali Jabat Kepala BNPT;https://www.liputan6.com/news/read/6141420/dilantik-prabowo-eddy-hartono-kembali-jabat-kepala-bnpt;Liputan6.com, Jakarta Presiden Prabowo Subianto melantik Irjen Eddy Hartono sebagai Kepala Badan Nasional Penanggulangan Terorisme (BNPT) di Istana Negara Jakarta, Senin (25/8/2025). Eddy sebelumnya dilantik menjadi Kepala BNPT pada tahun 2024 oleh Presiden ketujuh RI Joko Widodo atau Jokowi. Pelantikan Eddy Hartono berdasarkan pada Keputusan Presiden Republik Indonesia Nomor nomor 117/TPA tahun 2025 tentang Pemberhentian dan Pengangkatan Jabatan Tinggi Utama di Lingkungan Badan Nasional Penanggulangan Terorisme.
Partai Buruh Tak Turun Demo DPR Hari Ini, Siapkan Aksi Besar di Penjuru Indonesia untuk 28 Agustus;https://www.liputan6.com/news/read/6141407/partai-buruh-tak-turun-demo-dpr-hari-ini-siapkan-aksi-besar-di-penjuru-indonesia-untuk-28-agustus;Liputan6.com, Jakarta - Presiden Konfederasi Serikat Pekerja Indonesia (KSPI), Said Iqbal menegaskan partai buruh dan KSPI tidak ikut aksi di Gedung DPR RI pada Senin (25/8/2025). “Partai Buruh dan KSPI, serta Koalisi Serikat Pekerja atau KSP-PB menyatakan tidak ada aksi pada hari ini dimanapun, termasuk aksi di DPR maupun di seluruh Indonesia,” kata Iqbal kepada Liputan6.com, Senin (25/8/2025). Baca Juga Menurutnya, Partai Buruh dan KSPI serta Koalisi Serikat Pekerja atau KSP-PB akan turun ke jalan pada Kamis, 28 Agustus 2025. Ribuan buruh disebut akan aksi di depan gedung DPR. Advertisement “Ribuan buruh akan melakukan aksi 28 Agustus 2025 juga serempak dilakukan di 38 provinsi,” ungkapnya.
Kelanjutan Kasus Komplotan Judi Online Bobol Situs, 3 Admin Website Judol Internasional Ditangkap saat Subuh;https://www.liputan6.com/news/read/6141402/kelanjutan-kasus-komplotan-judi-online-bobol-situs-3-admin-website-judol-internasional-ditangkap-saat-subuh;Liputan6.com, Jakarta Direktorat Tindak Pidana Siber (Dittipidsiber) Bareskrim Polri menangkap tiga orang pengelola admin situs judi online di Jakarta Utara, 20 Agustus 2025. Mereka adalah bagian dari jaringan besar judol Internasional yang beroperasi lewat sejumlah website populer. Kasubdit 1 Dittipidsiber Bareskrim Polri Kombes Rizki Agung Prakoso menuturkan, pengungkapan kasus kali ini merupakan hasil pengembangan dari penangkapan lima tersangka pemain judi online oleh Ditreskrimsus Polda DIY pada 10 Juli 2025 lalu. Baca Juga “Setelah dilakukan penelusuran digital mendalam, penyidik menemukan adanya keterkaitan langsung antara para pemain dan jaringan operator yang dikelola oleh AF, BI, dan MR,” jelas Rizki kepada wartawan, Senin (25/8/2025). Advertisement 
