title;url;content
Minta Maaf, Eko Patrio Cerita Takut Joget Lagi Gara-Gara Videonya Viral;https://www.liputan6.com/news/read/6141227/minta-maaf-eko-patrio-cerita-takut-joget-lagi-gara-gara-videonya-viral;"Liputan6.com, Jakarta - Sekjen Partai Amanat Nasional (PAN) Eko Hendro Purnomo alias Eko Patrio mengaku takut untuk berjoget lagi usai videonya viral bersama anggota DPR lainnya di sidang tahunan MPR. Hal ini lantaran HUT ke-27 PAN dibalut meriah dengan hiburan musik. ""Baik, kamu jangan jauh-jauh ya, kalau jauh-jauh saya goyah. Apalagi tadi lihat joget, takut joget lagi saya nanti. Kalau saya joget viral malah,"" kata Eko di acara HUT ke-27 PAN di Jakarta, Minggu (24/8) malam."
Bahlil Singgung KPI Ketum Tambah Kursi di DPR: Kalau Turun, Mohon Maaf Prestasinya Tidak Bagus;https://www.liputan6.com/news/read/6141116/bahlil-singgung-kpi-ketum-tambah-kursi-di-dpr-kalau-turun-mohon-maaf-prestasinya-tidak-bagus;"Liputan6.com, Jakarta - Ketua Umum Partai Golkar, Bahlil Lahadalia, menginstruksikan kepada seluruh kader partai berlambang beringin itu untuk bekerja keras agar kursi di DPR RI bertambah pada Pemilihan Umum (Pemilu) tahun 2029. ""Kalau sekarang 102 kursi di DPR, maka harus kita naikkan menjadi di atas 102. Berapa-nya? Itu soal lain,"" katanya saat membuka Musyawarah Daerah (Musda) Golkar Sulawesi Tengah di Palu. Demikian dikutip dari Antara, Senin (25/8/2025). Baca Juga Bahlil Lahadaliamenjelaskan key performance indicator (KPI) seorang ketua umum dan pengurus partai, terletak dari seberapa banyak bisa menambah kursi di parlemen. Advertisement"
Rayakan HUT ke-27, PAN Gelar Award dengan Tema Pangan;https://www.liputan6.com/news/read/6141043/rayakan-hut-ke-27-pan-gelar-award-dengan-tema-pangan;"Liputan6.com, Jakarta - Partai Amanat Nasional (PAN) menggelar acara PAN Award sebagai rangkaian hari ulang tahun (HUT) ke-27 tahun. Acara digelar pada Minggu, (24/8/2025) malam. PAN memberikan penghargaan kepada sejumlah elemen masyarakat dan pegiat media sosial yang konsen terhadap ketahanan pangan. Baca Juga Sekjen PAN Hendro Purnomo alias Eko Patrio menyebut, acara award ini diberikan kepada masyarakat yang peduli akan ketahanan pangan dari berbagai daerah ini bertujuan memberikan apresiasi pada pejuang pangan. Advertisement ""Jargonnya adalah pangan terdepan. 27 tahun pangan terdepan, tema ini bukan sekedar hiasan, tetapi pesan kuat bahwa Partai Amanat Nasional akan terus berada di barisan terdepan dalam mendukung kedaulatan pangan Indonesia,"" kata Eko dalam sambutan. Menurutnya, PAN memiliki sejumlah program unggulan jelang HUT ke-27. Salah satunya, memberikan 2.700 bantuan pangan kepada masyarakat yang membutuhkan. ""Bantuan pangan di seluruh tingkatan DPW akan membagikan kurang lebih 2.700 bantuan pangan kepada masyarakat, ini menyatakan bukti bahwa PAN hadir dan selalu membantu dan memberikan manfaat kepada masyarakat,"" pungkasnya. "
HUT ke-27 PAN, Zulhas Puji Prabowo Satu-satunya Presiden yang Berani Terapkan Pasal 33 UUD 1945;https://www.liputan6.com/news/read/6141072/hut-ke-27-pan-zulhas-puji-prabowo-satu-satunya-presiden-yang-berani-terapkan-pasal-33-uud-1945;"Liputan6.com, Jakarta - Ketua Umum Partai Amanat Nasional (PAN) Zulkifli Hasan (Zulhas) memuji langkah Presiden Prabowo Subianto dalam menerapkan prinsip Pasal 33 UUD 1945. Yaitu dengan mengedepankan ekonomi gotong royong dan pemerataan. Hal itu disampaikan Zulhas saat memberikan sambutan dalam peringatan HUT ke-27 PAN, di Jakarta, Minggu (24/8/2025) malam. Baca Juga ""Saudara-saudara, kita punya Presiden Pak Prabowo Subianto, satu-satunya presiden yang berani menerapkan Pasal 33, pemberdayaan, pemerataan, gotong royong, ekonomi Pancasila,"" kata Zulhas. Advertisement Menurutnya, kebijakan yang diambil Prabowo sejalan dengan cita-cita PAN dalam memperjuangkan keadilan sosial dan pemberdayaan masyarakat. ""Nah itulah yang Partai Amanat Nasional perjuangkan hari-hari ini dan hari yang akan datang,"" ujarnya. Zulhas menyebut, semangat ekonomi Pancasila yang dijalankan Prabowo harus terus didukung agar mampu menghadirkan pemerataan kesejahteraan bagi seluruh rakyat Indonesia. Adapun, Pasal 33 UUD 1945 merupakan landasan perekonomian Indonesia yang menekankan prinsip demokrasi ekonomi dengan asas kekeluargaan dan gotong royong. "
Prabowo Sambangi Kediaman Ma’ruf Amin, Cium Tangan Lalu Diskusi Bahas Pembangunan RI;https://www.liputan6.com/news/read/6140951/prabowo-sambangi-kediaman-maruf-amin-cium-tangan-lalu-diskusi-bahas-pembangunan-ri;"Liputan6.com, Jakarta - Presiden Prabowo Subianto menyambangi kediaman Wakil Presiden Republik Indonesia ke-13, K.H. Ma’ruf Amin di Depok, Jawa Barat, hari ini. Tampak dalam kunjungan tersebut, kepala negara menunduk dan mencium tangan sang kiai. Mengutip informasi yang dipublikasi sosial media resmi presiden, kunjungan itu menjadi bentuk silaturahmi dengan tujuan mempererat tali persaudaraan. Baca Juga ""Presiden menyambangi dalam rangka silaturahmi dan mempererat tali persaudaraan,"" tulis Tim Media Prabowo Subianto seperti dikutip Minggu (24/8/2025). Advertisement Dalam kunjungannya, Prabowo disebut berdiskusi dan bertukar pikiran dengan Ma'ruf Amin perihal pembangunan bangsa. ""Kedua pemimpin berdiskusi dan bertukar pikiran mengenai arah pembangunan bangsa ke depan,"" jelas keterangan tersebut. Prabowo berharap, kunjungan itu diartikan hubungan baik antar pemimpin Republik Indonesia dari masa ke masa. ""Kunjungan ini juga mencerminkan kehangatan hubungan antar pemimpin bangsa serta menegaskan semangat persatuan yang senantiasa menjadi landasan kokoh dalam perjalanan Indonesia,"" dia menandasi. "
Survei: Abolisi dan Amnesti Tak Guncang Hubungan Prabowo-Jokowi;https://www.liputan6.com/news/read/6140838/survei-abolisi-dan-amnesti-tak-guncang-hubungan-prabowo-jokowi;Liputan6.com, Jakarta - Hasil survei nasional Polling Institute menunjukkan mayoritas publik tidak percaya bahwa hubungan Presiden Prabowo Subianto dengan Presiden ke-7 RI, Joko Widodo (Jokowi), retak usai kebijakan pemberian abolisi dan amnesti kepada Tom Lembong dan Hasto Kristiyanto. Dalam survei yang digelar pada 4–7 Agustus 2025 itu, sebanyak 52,1 persen responden menyatakan tidak percaya (28,3 persen kurang percaya dan 23,8 persen tidak percaya sama sekali) terhadap anggapan bahwa hubungan Prabowo–Jokowi tidak harmonis pasca kebijakan tersebut. Baca Juga Sementara itu, yang menyatakan percaya hanya 23,2 persen (3,6 persen sangat percaya dan 19,6 persen cukup percaya). Adapun sisanya, 24,8 persen, memilih tidak tahu atau tidak menjawab. Advertisement “Temuan ini mengindikasikan bahwa publik melihat hubungan Prabowo dan Jokowi relatif stabil, meskipun muncul kebijakan yang berpotensi menimbulkan tafsir politik seperti pemberian abolisi dan amnesti,” ujar Kennedy Muslim, Peneliti Utama Polling Institute, saat memaparkan rilis survei bertajuk ‘Tingkat Kepercayaan Publik Terhadap Lembaga Negara dan Isu-Isu Politik Terkini’ secara virtual, Minggu (24/8). Menurut Kennedy, mayoritas publik menilai kebijakan Prabowo tersebut lebih sebagai langkah politik yang berorientasi pada rekonsiliasi, bukan pemicu disharmoni. “Responden cenderung menilai keputusan Presiden justru memperluas ruang politik inklusif, sehingga isu retaknya hubungan Prabowo–Jokowi tidak terlalu dipercaya,” jelasnya. 
Jelang Muktamar, PPP Jakarta Solid Dukung Mardiono;https://www.liputan6.com/news/read/6140995/jelang-muktamar-ppp-jakarta-solid-dukung-mardiono;"Liputan6.com, Jakarta - Jelang Muktamar X, Dewan Pimpinan Wilayah Partai Persatuan Pembangunan (DPW PPP) DKI Jakarta menggelar Musyawarah Kerja Wilayah (Mukerwil) ke-3, di Pulau Tidung, Kepulauan Seribu, Jakarta, 23-24 Agustus 2025. Dalam sambutannya Ketua DPW PPP DKI Jakarta Saiful Rahmat Dasuki (jipul) mengatakan bahwa Mukerwil III Ini diselenggarakan menjelang Muktamar setelah sebelumnya serangkaian mukercab sejak 3 Agustus 2025 kemarin yang dimulai dari DPC Jakarta Pusat dan diakhiri hari ini di DPC pulang seribu. Baca Juga Hasil mukercab dari seluruh DPC se-DKI Jakarta sepakat dan tetap solid mendukung Muhamad Mardiono sebagai ketua umum periode berikutnya. Advertisement ""Jika Ketum bilang langit itu hijau, maka kami akan sebut langit itu hijau,"" ungkapnya. ""Jadi hari ini mukerwil III PPP DKI Jakarta hanya meneruskan aspirasi di bawah dan tentunya nanti banyak hal-hal yang perlu kita evaluasi dan bicarakan serta mencari solusi terbaik agar PPP DKI Jakarta bisa bangkit kembali dan tetap jaya Dengan ridho Allah SWT sebagai partainya umat Islam,"" tegasnya. Jipul juga mengatakan saat ini Jakarta membutuhkan Muhamad Mardiono untuk kembali memimpin Partai berlambang Ka'bah. “Kalau kami Jakarta hari ini memandang, kamilah yang membutuhkan Pak Mardiono untuk kembali memimpin,” ungkapnya. Kehadiran Ketum Mardiono pada Mukerwil III ini beserta para pengurus DPP PPP lainnya menurutnya sangat luar biasa. “Ini surprise sekali, terima kasih Pak Ketum, karena tadi sudah saya sampaikan bahwa ini juga merupakan janji Pak Ketum untuk datang ke Kepulauan Seribu. Hari ini dibayar tunai oleh Pak Ketum dan teman-teman dari DPP. Kami sangat bangga sekali hari ini,” ujarnya. "
Mardiono: Kalau Mayoritas Kader Menghendaki, Saya Siap Kembali Pimpin PPP;https://www.liputan6.com/news/read/6140888/mardiono-kalau-mayoritas-kader-menghendaki-saya-siap-kembali-pimpin-ppp;"Liputan6.com, Jakarta - Plt Ketua Umum PPP Muhamad Mardiono bersuara soal dirinya yang akan dicalonkan kembali sebagai ketua umum PPP secara definitif. Dia menegaskan, menegaskan dirinya tidak ada ambisi pribadi dan menyerahkan sepenuhnya kepada kader di forum Muktamar. “Saya dalam hal ini memimpin adalah amanah, saya tidak berambisi,” kata Mardiono seperti dikutip dari siaran pers, Minggu (24/8/2025). Baca Juga Meski begitu, dia tak menampik jika dukungan menakhodai PPP secara definitif bermunculan dari berbagai daerah. Karenanya, jika memang para kader menghendaki, maka Mardiono siap kembali menahkodai PPP secara definitif. Advertisement ""Kalau kader mayoritas menghendaki saya untuk memimpin kembali, Insya Allah saya memenuhi panggilan itu,"" tegas dia. Berbicara soal Pemilu 2029, Mardiono mengaku saat ini PPP mulai memanaskan mesin politik. Hal itu disampaikan Mardiono saat menghadiri Musyawarah Kerja Wilayah (Mukerwil) PPP Kepulauan Seribu, Sabtu (23/8). ""Mukerwil adalah pijakan penting dalam konsolidasi internal partai yang akan menghasilkan beberapa ide, gagasan, yang akan disampaikan lebih lanjut pada Muktamar mendatang,"" sebut Mardiono. Dia memastikan, setiap agenda politik yang dijalankan partai akan diarahkan pada persiapan menghadapi kontestasi nasional mendatang. “Tentu adalah pijakan kita untuk konsolidasi, mempersiapkan, termasuk membuat rencana kerja menyongsong Pemilu 2029 yang akan datang,” Mardiono menandasi.  "
Survei: Mayoritas Publik Tak Percaya Isu Ijazah Palsu Jokowi;https://www.liputan6.com/news/read/6140901/survei-mayoritas-publik-tak-percaya-isu-ijazah-palsu-jokowi;Liputan6.com, Jakarta - Survei nasional Polling Institute menunjukkan mayoritas masyarakat tidak mempercayai isu ijazah palsu yang ditudingkan kepada mantan Presiden Joko Widodo (Jokowi). Meski cukup massif terdengar di ruang publik, tingkat kepercayaan publik terhadap isu tersebut sangat rendah. Baca Juga Peneliti Utama Polling Institute, Kennedy Muslim, memaparkan 73,3 persen responden mengaku pernah mendengar isu ijazah palsu Jokowi, sementara 26,7 persen sama sekali tidak mengetahui. Advertisement “Artinya, isu ini memang cukup massif terdengar di ruang publik, namun pemaknaannya beragam di tengah masyarakat,” kata Kennedy saat merilis hasil survei secara virtual, Minggu (24/8/2025). Dari kelompok yang mengetahui isu ini, mayoritas justru tidak mempercayainya. Sebanyak 41,5 persen responden menyatakan tidak percaya sama sekali, 25,6 persen kurang percaya, sementara hanya 11,8 persen percaya dan 1,9 persen sangat percaya. Adapun 19,2 persen menjawab tidak tahu atau tidak merespons. 
Noel Minta Amnesti, Komisi III: Tidak Bisa Diberikan Sembarangan;https://www.liputan6.com/news/read/6140676/noel-minta-amnesti-komisi-iii-tidak-bisa-diberikan-sembarangan;"Liputan6.com, Jakarta - Anggota Komisi III DPR RI, Hinca Pandjaitan menyatakan pemberian amnesti tidak bisa dilakukan sembarangan. Ia mengingatkan, ada prosedur pemberian dan pertimbangan yang harus sangat matang. Hal tersebut menanggapi Wakil Menteri Ketenagakerjaan (Wamenaker) Immanuel Ebenezer alias Noel yang berharap mendapat amnesti dari Presiden Prabowo Subianto. Baca Juga ""Dalam kasus ini, saya tidak melihat ada pertimbangan yang khusus untuk ditimbang Presiden. Apalagi ia adalah wamennya Presiden yang punya program Asta Cita memberantas korupsi,"" kata Hinca pada wartawan, Minggu (24/8/2025). Advertisement Hinca menyebut, perbuatan Noel telah melukai rasa keadilan publik sehingga tak ada hal baik untuk jadi bahan pertimbangan pemberian amnesti. ""Saya tak melihat ada hal-hal yang dapat dipertimbangkan memberi pengampunan amnesti,"" kata dia. "
NasDem Minta Wakil Rakyatnya Tak Salah Gunakan Kewenangan;https://www.liputan6.com/news/read/6140663/nasdem-minta-wakil-rakyatnya-tak-salah-gunakan-kewenangan;"Liputan6.com, Jakarta - Ketua DPP NasDem Bidang Pemenangan Pemilu Provinsi Jawa Barat, Idris Sandiya menyampaikan kekuasaan dimiliki partai harus digunakan untuk menolong masyarakat. Khususnya para wakil rakyat dari fraksinya yang banyak mengisi kursi di DPRD Karawang. “Nasdem di Karawang ini memiliki jumlah kursi yang banyak, bahkan juga punya pimpinan DPRD. Untuk itu, kewenangan dan kekuasaan yang kita miliki harus kita gunakan untuk menolong sebanyak mungkin masyarakat, sehingga bisa memberikan dampak dan manfaat yang nyata,” kata Idris dalam acara pelantikan pengurus DPD NasDem Kabupaten Karawang, Minggu (24/8/2025). Baca Juga Idris menambahkan, diperlukan sinergi dan kolaborasi baik secara internal maupun eksternal dengan pemerintah daerah setempat agar kekuatan NasDem semakin besar dan berdampak luas. Tujuannya, agar NasDem semakin besar dan kebermanfaatannya semakin bisa dirasakan oleh masyarakat. Advertisement ""Kita juga perlu sinergi dan kolaborasi dengan kekuatan yang ada, termasuk juga sinergi dengan Pemerintah Daerah agar program-program pemerintah bisa kita pastikan diterima oleh masyarakat” jelas dia. "
KPK Ungkap Momen Noel Ebenezer Minta Jatah ke 'Sultan' Kemnaker: Saya Cocoknya Motor Apa?;https://www.liputan6.com/news/read/6140598/kpk-ungkap-momen-noel-ebenezer-minta-jatah-ke-sultan-kemnaker-saya-cocoknya-motor-apa;Liputan6.com, Jakarta  - Komisi Pemberantasan Korupsi (KPK) mengungkapkan Immanuel Ebenezer Gerungan (IEG) saat menjabat sebagai Wakil Menteri Ketenagakerjaan mendapatkan satu unit kendaraan roda dua atau motor setelah bertanya kepada Koordinator Bidang Kelembagaan dan Personel K3 Kemenaker Irvian Bobby Mahendro (IBM). “Saat minta motor, IEG ngomong ke IBM:'Saya tahu kamu main motor besar. Kalau untuk saya (IEG), cocoknya motor apa?' ” kata Ketua KPK Setyo Budiyanto saat dikonfirmasi di Jakarta, Sabtu, 23 Agustus 2025. Baca Juga Perbincangan tersebut berkaitan dengan kasus dugaan pemerasan dalam pengurusan sertifikat Keselamatan dan Kesehatan Kerja (K3) di lingkungan Kemenaker. Advertisement “Kemudian IBM membelikan, dan kirim ke rumahnya IEG, satu Ducati,” ujarnya. Setyo menjelaskan pembelian satu motor Ducati tersebut dilakukan secara off the road atau tanpa surat-surat. Oleh sebab itu, kata dia, KPK menduga cara pembelian tersebut dilakukan dengan tujuan untuk menyembunyikan transaksi. 
Said Abdullah Juga Mundur Sebagai Ketua DPD PDIP Jatim: Sesuai Anggaran Dasar Partai;https://www.liputan6.com/news/read/6140377/said-abdullah-juga-mundur-sebagai-ketua-dpd-pdip-jatim-sesuai-anggaran-dasar-partai;"Liputan6.com, Jakarta Ketua DPP PDI Perjuangan (PDIP) Bidang Sumber Daya, Said Abdullah, mengatakkan pemberhentian sejumlah Ketua DPD PDIP oleh Ketua Umum Megawati Soekarnoputri bukan tindakan sepihak, melainkan mekanisme sesuai Anggaran Dasar (AD) dan Peraturan Partai. ""Proses pemberhentian para Ketua DPD adalah mekanisme yang memang telah diatur oleh AD dan Peraturan Partai. Karena normanya begitu, maka hal itu harus dilaksanakan oleh Ketua Umum dan DPP Partai,"" ujar Said dalam keterangan tertulis, Sabtu (23/8/2025). Baca Juga Menurutnya, aturan larangan rangkap jabatan dibuat agar struktur partai di tiap tingkatan lebih fokus menjalankan konsolidasi dan pengembangan partai. Advertisement ""Anggota atau kader partai yang ditetapkan menjadi pengurus DPP tidak boleh merangkap jabatan struktural di atas maupun di bawahnya, dan secara otomatis dianggap mengundurkan diri dari jabatan sebelumnya, kecuali Ketua Umum menentukan lain,"" tutur Said membacakan Anggaran Dasar PDIP dan Peraturan Partai PDIP Nomor 1 Tahun 2025."
PDIP Luruskan Isu Bambang Pacul Dicopot dari Ketua DPD Jateng;https://www.liputan6.com/news/read/6139938/pdip-luruskan-isu-bambang-pacul-dicopot-dari-ketua-dpd-jateng;"Liputan6.com, Jakarta - Ketua DPP PDIP, Komarudin Watubun, menyebut, pergantian Bambang Wuryanto alias Bambang Pacul dari Ketua DPD PDIP Jawa Tengah, merupakan bagian dari konsolidasi partai. Hal ini sekaligus membantah informasi yang menyebut Pacul dicopot dari jabatannya. ""Kan, ada yang bilang Mas Pacul dicopot, itu nggak benar. Itu konsolidasi biasa saja, jadi jangan diputar-putar,"" ujar Komarudin dalam keterangannya, Jumat (22/8/2025). Baca Juga Ketua Bidang Kehormatan Partai itu menegaskan, setelah Kongres VI di Bali pada awal Agustus 2025 lalu, DPP diminta oleh Ketua Umum PDIP Megawati Soekarnoputri untuk fokus pada konsolidasi. Advertisement Konsolidasi dimaksud ialah konsolidasi organisasi untuk pembentukan DPD, DPC, ranting hingga anak ranting seluruh Indonesia. Atas dasar itu, Kongres VI telah memutuskan dalam AD/ART Partai bahwa pengurus DPP periode 2025–2030 tidak lagi boleh merangkap jabatan, baik ke struktur atas maupun ke bawah. Ketentuan ini berlaku bagi siapa pun tanpa terkecuali. ""Itu dasarnya, dasar organisasinya, putusannya. Kemudian pemberlakuan kepada siapa? Ya kepada seluruh teman-teman yang sekarang merangkap jabatan supaya fokus dalam konsolidasi organisasi ke depan,"" tegas Komarudin. "
Ada Perbedaan Hasil Hitung Cepat di PSU Papua, Ini Kata Pengamat;https://www.liputan6.com/news/read/6140469/ada-perbedaan-hasil-hitung-cepat-di-psu-papua-ini-kata-pengamat;"Liputan6.com, Jakarta - Komisi Pemilihan Umum (KPU) Papua resmi mengumumkan hasil rekapitulasi Pemungutan Suara Ulang (PSU) pemilihan gubernur pada 20 Agustus 2025. Hasilnya, pasangan Matius Fakhiri–Aryoko Rumaropen (MARI-YO) unggul tipis dengan perolehan 50,4 persen suara, sementara pasangan Benhur Tomi Mano – Constan Karma (BTM–CK) meraih 49,6 persen. Hasil tersebut menunjukkan persaingan ketat dua kandidat. Namun, menariknya, hasil quick count dua lembaga survei menunjukkan tingkat kedekatan yang berbeda dengan real count KPU. Advertisement Indikator Politik Indonesia mencatat pasangan MARI-YO meraih 50,46 persen dan BTM–CK 49,54 persen, nyaris identik dengan hasil resmi. Sebaliknya, quick count Poltracking Indonesia menempatkan MARI-YO pada kisaran 48,15–50,15 persen dan BTM–CK di 49,85–51,85 persen. Rentang ini masih membuka kemungkinan kedua pasangan saling unggul, berbeda dengan kepastian hasil KPU. Analis politik Agung Baskoro menilai ada tiga faktor utama yang menentukan akurasi quick count, pertama metodologi, kualitas SDM, dan sistem teknologi informasi. “Pertama, metodologi. Ini pengacakannya seperti apa? TPS terpilihnya berapa? Apakah 400 TPS atau hanya 250 TPS? Itu penting untuk memastikan hasil quick count bisa merepresentasikan keseluruhan pemilih,” ujar Agung, Jumat (22/8/2025). Selain metodologi, kata Agung, kualitas enumerator juga berpengaruh. “Mereka adalah ujung tombak pencatat data. Kalau ada kesalahan mencatat, maka hasil quick count bisa meleset,” jelasnya. Faktor ketiga adalah kekuatan sistem teknologi informasi. ""Ketika ratusan data dikirim bersamaan, sistem IT harus kuat dan tidak boleh down,” tegasnya. "
Bambang Pacul Dicopot dari DPD PDIP Jateng, Tugas 'Komandan Korea' Fokus Pemilu 2029;https://www.liputan6.com/news/read/6139340/bambang-pacul-dicopot-dari-dpd-pdip-jateng-tugas-komandan-korea-fokus-pemilu-2029;Liputan6.com, Jakarta Bambang Wuryanto atau yang akrab disapa Bambang Pacul tak lagi menjabat Ketua DPD PDIP Jawa Tengah. Jabatannya digantikan oleh FX Rudy. Politikus PDIP Guntur Romli menuturkan, sebagai kader senior, Bambang Pacul dibutuhkan untuk memenangkan Pemilu 2029. Baca Juga “Mas Pacul adalah kader senior, dikenal sebagai ‘Komandan Korea’ dibutuhkan pengalaman dan keahliannya untuk fokus skala nasional dalam Pemenangan Pemilu Legislatif 2029, karena itulah beliau ditarik dan difokuskan ke Pusat untuk benar-benar merancang strategi pemenangan Pemilu 2029,” kata Guntur saat dikonfirmasi, Jumat (22/8/2025). Advertisement
Bendahara PDIP Jateng Buka Suara Pencopotan Bambang Pacul, Singgung Hasil Kongres;https://www.liputan6.com/news/read/6139180/bendahara-pdip-jateng-buka-suara-pencopotan-bambang-pacul-singgung-hasil-kongres;"Liputan6.com, Jakarta Dewan Pimpinan Pusat (DPP) Partai Demokrasi Indonesia Perjuangan (PDIP) mencopot Bambang Wuryanto atau Bambang Pacul dari kursi Ketua DPD PDIP Jawa Tengah (Jateng). Pencopotan ini berawal dari Kongres yang digelar beberapa waktu lalu di Provinsi Bali. Bendahara DPD PDIP Jateng Agustina Wilujeng Pramestuti menuturkan, penggantian Bambang Pacul sebagai Ketua DPD PDIP Jateng adalah amanat kongres. Baca Juga ""Betul, dan itu adalah hasil dari kongres bahwa semua pengurus DPP yang hari ini terpilih menjadi DPP memang dilepaskan (jabatan) ketua DPD-nya,"" kata Agustina di Semarang. Dikutip dari Antara, Jumat (22/8). Advertisement Dia juga membenarkan bahwa mantan Wali Kota Solo FX Hadi Rudyatmo yang ditunjuk sebagai Pelaksana Tugas (Plt) Ketua DPD PDIP Jateng menggantikan Bambang Pacul. Tidak hanya Bambang Pacul, lanjut dia, tetapi ada sejumlah ketua DPD PDIP yang diganti karena sudah terpilih menjadi pengurus di DPP PDIP pada kongres ke-6 partai berlambang banteng itu pada awal Agustus lalu. ""Ada empat (ketua DPD) ya. Kalau yang saya tahu dari hasil informasi tadi malam itu ada Sulut, Jawa Timur, Bengkulu, Jawa Tengah. Ya yang sudah jadi (pengurus) DPP harus melepaskan diri,"" katanya."
Jejak Bambang Pacul di Kandang Banteng;https://www.liputan6.com/news/read/6138981/jejak-bambang-pacul-di-kandang-banteng;"Liputan6.com, Jakarta Ketum PDIP Megawati Soekarnoputri akhirnya mencopot sang komandan pemenangan partainya di Kandang Banteng. Bambang Wuryanto, alias Bambang Pacul yang rekam jejaknya panjang di Jawa Tengah harus diganti. Megawati menunjuk FX Rudy yang memimpin PDIP Jawa Tengah. Baca Juga Bambang Pacul dicopot karena alasan rangkap jabatan sebagai Ketua Bappilu PDIP. Advertisement Berdasarkan Anggaran Dasar dan Anggaran Rumah Tangga (AD/ART) Partai Tahun 2025 serta Peraturan Partai Nomor 1 Tahun 2025, kader partai yang telah ditetapkan sebagai pengurus DPP PDIP, tidak diperbolehkan merangkap jabatan pada struktur kepengurusan di tingkat lain. ""Anggota partai, Kader partai yang telah diputuskan dan ditetapkan menjadi Dewan Pimpinan Partai, tidak boleh merangkap jabatan pada struktur pengurus partai di atasnya atau di bawahnya,"" jelas Ketua DPP PDIP Bidang Keanggotaan dan Organisasi, Andreas Hugo Pareira. Bagaimana kiprah Bambang Pacul di Jawa tengah?"
