title;url;content
Penjelasan Pengelola soal Wacana Harga Tiket Ragunan Naik: Insya Allah Enggak Mahal Kok;https://www.liputan6.com/news/read/6138462/penjelasan-pengelola-soal-wacana-harga-tiket-ragunan-naik-insya-allah-enggak-mahal-kok;"Liputan6.com, Jakarta Pihak Taman Margasatwa Ragunan menanggapi wacana kenaikan harga tiket sebagaimana rencana Gubernur Jakarta, Pramono Anung. Besarannya sejauh ini masih belum diketahui, sementara yang tercantum masih Rp4 ribu untuk dewasa dan Rp3 ribu anak-anak per sekali masuk. ""Insya Allah enggak mahal kok kalau benar, Insya Allah mudah-mudahan ya. Nanti kan akan dikaji banyak pihak ya, termasuk anggota dewan ya. Tidak mungkin kita menentukan sendiri itu,” tutur Humas Ragunan Wahyudi Bambang saat dikonfirmasi, Kamis (21/8/2025)."
Ada Demo Mahasiswa Hari Ini di DPR, Polisi Imbau Warga Hindari Kawasan Senayan;https://www.liputan6.com/news/read/6138207/ada-demo-mahasiswa-hari-ini-di-dpr-polisi-imbau-warga-hindari-kawasan-senayan;"Liputan6.com, Jakarta Ribuan personel gabungan akan dikerahkan untuk mengawal aksi unjuk rasa Gerakan Mahasiswa Bersama Rakyat (GEMARAK) bersama sejumlah elemen masyarakat. Unjuk rasa rencana akan dilakukan di depan Gedung DPR/MPR, Jakarta Pusat, Kamis (21/8/2025). Baca Juga ""Sebanyak 1.145 personel gabungan dari Polda, Polres Metro Jakarta Pusat dan Polsek jajaran disiagakan untuk mengamankan aksi unjuk rasa,"" kata Kapolres Metro Jakarta Pusat, Kombes Pol Susatyo Purnomo Condro dalam keterangan tertulis, Kamis pagi. Advertisement Aksi unjuk rasa diperkirakan akan berlangsung pada pukul 14.00 WIB. Susatyo menegaskan pengamanan dilakukan secara persuasif. “Polisi hadir bukan untuk menghadapi musuh, melainkan untuk melayani saudara-saudara kita yang ingin menyampaikan pendapat. Silakan berorasi dengan tertib, jangan memprovokasi, jangan melawan petugas, dan mari kita hindari tindakan seperti membakar ban, menutup jalan, atau merusak fasilitas umum,” kata Susatyo. "
Ahok Usul Tiket Transportasi dan Penyaluran Bansos di Jakarta Pakai Voucher Digital;https://www.liputan6.com/news/read/6138093/ahok-usul-tiket-transportasi-dan-penyaluran-bansos-di-jakarta-pakai-voucher-digital;Liputan6.com, Jakarta Mantan Gubernur DKI Jakarta Basuki Tjahaja Purnama (Ahok), menyarankan agar Pemerintah Provinsi (Pemprov) DKI menggunakan sistem voucher digital dalam hal transportasi. Menurut Ahok, sistem tiket konvensional bisa diganti dengan voucher digital. “Zaman berubah kan, zaman berubah belum tentu yang saya (terapkan) contoh dulu parkir pakai sistem mesin, zaman saya nih, sekarang mungkin sudah tidak efisien karena semua orang tukang parkir punya HP. Kenapa enggak digital aja gitu loh. Nah mungkin harus dicocokkan kayak gitu,” kata Ahok di Balai Kota DKI Jakarta, Rabu (20/8/2025). Selain itu, Ahok juga menyarankan penggunaan sistem voucher digital dalam penyaluran bantuan milik pemerintah daerah. Dia menilai, penerapan sistem ini mampu menciptakan efisiensi dan akuntabilitas pengelolaan anggaran, sekaligus menekan potensi penyalahgunaan dana. Baca Juga Ahok menyebut, konsep voucher digital berbeda dengan pembagian bantuan tunai atau diskon biasa. Dengan sistem ini, bantuan yang diberikan pemerintah berupa poin atau kredit digital dapat digunakan masyarakat untuk keperluan tertentu, misalnya transportasi atau belanja kebutuhan pokok. Advertisement “Kenapa pakai voucher itu penting? Kalau kamu bagiin-bagiin orang, kasih diskon, begitu dia enggak pakai atau dia jual duit Pemda keluar,” ujar Ahok.
Gempa Bekasi Magnitudo 4,9: KRL Jabodetabek Terganggu Hingga Berhenti Sementara;https://www.liputan6.com/news/read/6137950/gempa-bekasi-magnitudo-49-krl-jabodetabek-terganggu-hingga-berhenti-sementara;Liputan6.com, Jakarta Gempa berkekuatan 4,9 Magnitudo mengguncang Ibu kota Jakarta. Pusat gempa dikabarkan berada 10 kilometer dari Bekasi, Jawa Barat. Guncangan gempa membuat perjalanan KRL Jabodetabek terhambat. Aditya Eka Prawira, salah satu penumpang KRL menuturkan, kereta di Stasiun Tanah Abang tidak bisa diberangkatkan saat terjadi gempa. Baca Juga “Tadi pengumuman di speaker Mohon Maaf sehubungan dengan adanya gempa bumi dengan skala 4,9,” ujar Adit kepada Liputan6.com, Rabu (20/8/2025). Advertisement 
Hujan Deras Bikin 3 Pohon Tumbang di Jaksel, Gapura dan 2 Ruko Tertimpa;https://www.liputan6.com/news/read/6137932/hujan-deras-bikin-3-pohon-tumbang-di-jaksel-gapura-dan-2-ruko-tertimpa;"Liputan6.com, Jakarta - Sebuah gapura dan dua rumah toko (Ruko) di Jakarta Selatan rusak tertimpa tiga pohon yang tumbang akibat hujan deras pada Rabu sore sekitar pukul 17.45 WIB. ""Sampai saat ini kami mengevakuasi tiga pohon tumbang di Jakarta Selatan,"" kata Kepala Pusat Data dan Informasi (Kapusdatin) BPBD DKI Jakarta, Mohamad Yohan, di Jakarta, dikutip dari Antara, Rabu (20/8/2025). Baca Juga Yohan menjelaskan, salah satu pohon tumbang terjadi di Jalan Pangeran Antasari Nomor 6 RT 10/RW 01, Cilandak Barat, Cilandak, yang mengakibatkan sebuah gapura perumahan tertimpa. Advertisement Kemudian, pohon tumbang di Jalan Haji Ipin RT 07/RW 01, Pondok Labu, Cilandak, menimpa dua rumah toko (ruko) atau kios. ""Lalu di Jalan Raya Lenteng Agung RT 12/RW 08, Lenteng Agung, Jagakarsa,"" katanya. Badan Penanggulangan Bencana Daerah (BPBD) DKI Jakarta mengerahkan personel gabungan yang terdiri dari petugas Penanganan Prasarana dan Sarana Umum (PPSU), Suku Dinas Pertamanan dan Hutan Kota (Sudin Tamhut) dan Badan Penanggulangan Bencana Daerah (BPBD) DKI Jakarta. Lalu, personel Satuan Polisi Pamong Praja (Satpol PP) serta Suku Dinas Penanggulangan Kebakaran dan Penyelamatan (Gulkarmat) Jakarta Selatan juga dikerahkan untuk mengevakuasi pohon yang tumbang tersebut. ""Sedang ditangani petugas bersama warga bahu-membahu memotong batang pohon agar lalu lintas kembali normal,"" katanya. "
Gempa Magnitudo 4,9 di Bekasi, Gedung Tinggi di Jakarta Bergoyang!;https://www.liputan6.com/news/read/6137927/gempa-magnitudo-49-di-bekasi-gedung-tinggi-di-jakarta-bergoyang;Liputan6.com, Jakarta Gempa terjadi di wilayah Jakarta dan sekitarnya, Pukul 19.57 WIB, Rabu (20/8/2025). Sejumlah karyawan di gedung perkantoran Jakarta merasakan gempa tersebut. Getaran gempa terasa kencang di Menteng, Jakarta Pusat. Menurut BMKG, kekuatan magnitudo 4,9. Pusat gempa terjadi di darat Kabupaten Bekasi. Getaran terasa bukan hanya di Jakarta. Tapi sampai ke Depok, Cianjur dan Sukabumi. Baca Juga Antisipasi Gempa Bumi Advertisement Ini yang harus dilakukan sebelum, sesaat, dan sesudah gempa bumi. Sebelum Gempa:- Pastikan bahwa struktur dan letak rumah Anda dapat terhindar dari bahaya yang disebabkan oleh gempa, seperti longsor atau likuefaksi. Evaluasi dan renovasi ulang struktur bangunan Anda agar terhindar dari bahaya gempabumi. - Kenali lingkungan tempat Anda bekerja: perhatikan letak pintu, lift, serta tangga darurat. Ketahui juga di mana tempat paling aman untuk berlindung. - Belajar melakukan P3K dan alat pemadam kebakaran. - Catat nomor telepon penting yang dapat dihubungi pada saat terjadi gempabumi. - Atur perabotan agar menempel kuat pada dinding untuk menghindari jatuh, roboh, bergeser pada saat terjadi gempabumi. - Atur benda yang berat sedapat mungkin berada pada bagian bawah. Cek kestabilan benda yang tergantung yang dapat jatuh pada saat gempabumi terjadi - Simpan bahan yang mudah terbakar pada tempat yang tidak mudah pecah agar terhindar dari kebakaran. - Selalu mematikan air, gas dan listrik apabila tidak sedang digunakan. - Siapkan alat yang harus ada di setiap tempat: Kotak P3K, senter/lampu baterai, radio, makanan suplemen dan air. 
Aksi Komplotan Penipu Modus Tukar ATM di Bandara Soetta Terbongkar, Satu Pelaku Dibekuk Polisi;https://www.liputan6.com/news/read/6137893/aksi-komplotan-penipu-modus-tukar-atm-di-bandara-soetta-terbongkar-satu-pelaku-dibekuk-polisi;"Liputan6.com, Jakarta - Polres Bandara Soekarno Hatta berhasil membekuk seorang pelaku penipuan bermodus tukar kartu ATM. Aksi komplotan ini terungkap setelah seorang penumpang pesawat berinisial MN melaporkan kehilangan saldo rekening hingga puluhan juta rupiah. Dari tiga pelaku, satu di antaranya telah ditangkap, sementara dua lainnya masih dalam pengejaran. Baca Juga ""Satu pelaku kami tangkap berinisial MAZ dan dua pelaku berinisial A dan M masih diburu,"" kata Kasat Reskrim Polres Bandara Soekarno Hatta, Kompol Yandri Mono, Rabu (20/8/2025). Advertisement Yandri menambahkan, pelaku MAZ merupakan residivis kasus yang sama dan baru beberapa bulan keluar dari penjara di wilayah Bogor. Bukannya kapok, dia malah beraksi kembali dengan kedua temannya dengan modus yang sama, dan membagi peran. ""Peristiwa tersebut terjadi pada Jumat, 20 Juni 2025 sekitar pukul 09.00 WIB di kawasan Terminal 1 Bandara Soekarno Hatta,"" katanya. Menurut Kanit 4 Indag Krimsus Polres Bandara Soekarno Hatta, Iptu Agung Pujianto, korban diketahui baru tiba dari Kupang menggunakan pesawat Citilink QG603. Saat menunggu penerbangan lanjutan ke Lampung, korban bertemu dengan dua pria yang belakangan diketahui bernama A dan M. "
Ahok Muncul di Balai Kota Temui Pramono Anung, Bahas Apa?;https://www.liputan6.com/news/read/6137798/ahok-muncul-di-balai-kota-temui-pramono-anung-bahas-apa;Liputan6.com, Jakarta - Mantan Gubernur DKI Jakarta, Basuki Tjahaja Purnama (Ahok), bertemu dengan Gubernur DKI Jakarta Pramono Anung di Balai Kota Jakarta, Rabu (20/8/2025). Pertemuan antara keduanya membahas sejumlah isu strategis, mulai dari evaluasi Pajak Bumi dan Bangunan (PBB), digitalisasi pembayaran layanan publik, hingga peningkatan kualitas pendidikan di Jakarta. Baca Juga Ahok juga menyoroti mengenai wacana kenaikan PBB di sejumlah daerah. Ia mengingatkan bahwa penyesuaian PBB harus mengacu pada Nilai Jual Objek Pajak (NJOP) dan tidak boleh melebihi harga pasar. Advertisement “Prinsip PBB itu tidak boleh melebihi NJOP. Dulu, saat saya menjabat, kami menaikkan PBB karena harga jual dan NJOP terlalu jauh berbeda. Sekarang kondisinya berbeda, banyak tanah dijual tetapi NJOP-nya tinggi, bahkan kadang tidak sesuai harga pasar,” kata Ahok. Ahok menilai, jika kondisi ekonomi melemah dan harga properti menurun, beberapa wilayah justru perlu menurunkan PBB, bukan malah menaikkan. Kebijakan soal PBB harus mengadministrasikan keadilan sosial, bukan sekadar menambah pendapatan daerah.  
Pramono Anung Rasakan Sendiri Kemacetan di Jalan TB Simatupang, Janjikan Hal Ini;https://www.liputan6.com/news/read/6137164/pramono-anung-rasakan-sendiri-kemacetan-di-jalan-tb-simatupang-janjikan-hal-ini;"Liputan6.com, Jakarta Gubernur DKI Jakarta, Pramono Anung mengakui kemacetan parah di Jalan TB Simatupang, Jakarta Selatan bak mimpi buruk. Pramono juga telah mengecek sendiri kondisi kemacetan tersebut karena adanya proyek galian. Oleh sebab itu, dia meminta agar bedeng-bedeng proyek galian itu bisa diperkecil, sehingga lajur jalan tidak semakin sempit. Pramono juga ingin 'pak ogah' di sekitar kawasan Jalan TB Simatupang turut ditertibkan. Baca Juga ""Tanggal 16 kemarin saya sengaja mencoba, saya bersama sopir berdua saja memang parah. Memang kondisi lapangannya sangat sulit, beberapa pekerjaan itu sebenarnya bedengnya bisa dikecilin, kita minta itu untuk dikecilin. Kalau perlu Gubernur tanda tangan, saya tanda tangan,"" kata Pramono dikutip dari unggahan Instagram @pramonoanungw, Rabu (20/8/2025). Advertisement Menurutnya, terkait dengan keberadaan 'pak ogah' diperlukan kolaborasi lintas satuan kerja perangkat daerah (SKPD) untuk proses penertiban. Sehingga bisa mengatasi kemacetan di sana.  "
Penyebab Kebakaran di Apartemen City Park Jakarta Barat Terungkap;https://www.liputan6.com/news/read/6137041/penyebab-kebakaran-di-apartemen-city-park-jakarta-barat-terungkap;"Liputan6.com, Jakarta Kebakaran di Apartemen City Park, Jakarta Barat, Selasa (19/8) malam, disebabkan oleh kebocoran gas. Hal ini diungkapkan oleh Suku Dinas (Sudin) Penanggulangan Kebakaran dan Penyelamatan (Gulkarmat) Jakarta Barat. ""Dugaan penyebab kebakaran adanya kebocoran gas pada saat sedang memasak,"" kata Kepala Seksi Operasi Sudin Gulkarmat Jakarta Barat Syarifudin saat dikonfirmasi. Dikutip dari Antara. Baca Juga Syarifudin juga menjelaskan perkiraan luas area yang terbakar kurang lebih 12 meter persegi, dengan estimasi jumlah kerugian sekitar Rp45 juta. Advertisement ""Korban jiwa nihil, korban selamat 10 orang namun ada satu orang korban luka sedang yang mengalami luka bakar dan sudah dibawa ke RS Bunda Suci,"" ucapnya."
Komplotan Curanmor Ditangkap di Depok, Kerap Beraksi Pakai Airsoft Gun untuk Takuti Korban;https://www.liputan6.com/news/read/6136923/komplotan-curanmor-ditangkap-di-depok-kerap-beraksi-pakai-airsoft-gun-untuk-takuti-korban;"Liputan6.com, Jakarta - Polres Metro Depok berhasil meringkus lima tersangka pencurian kendaraan bermotor (Curanmor) berinsial SAP, FQA, SF, AR, dan anak berhadaan hukum. Saat beraksi, kawanan curanmor kerap membawa Airsoft Gun untuk menakuti korban. Kasat Reskrim Polres Metro Depok, Kompol Made Gede Oka Utama membenarkan telah menangkap lima tersangka curanmor. Dari kelima tersangka yang tertangkap, terdapat anak dibawah umur turut terlibat. Baca Juga ""Kelima tersangka memiliki peran yang berbeda, ada yang sebagai pemetik dan ada yang sebagai penadah,"" ujar Made, Selasa (19/8/2025). Advertisement Made menjelaskan, pada penangkapan kelima tersangka di wilayah Cipayung, polisi tidak hanya mengamankan barang bukti berupa kunci letter T. Polisi menemukan adanya senjata Airsoft Gun yang digunakan para tersangka. ""Kami juga mendapatkan para tersangka ini menggunakan airsoft gun"" jelas Made. Berdasarkan keterangan sementara dari para tersangka, kawanan curanmor melakukan aksinya secara acak, baik di jalan raya maupun rumah di kawasan gang. Kawanan curanmor telah membekali diri menggunakan kunci letter T untuk mengambil motor korban. ""Senjata Airsoft Gun digunakan untuk menakuti korban, namun saat pemeriksaan para tersangka mengaku belum pernah menggunakannya,"" terang Made. "
Polisi Masih Selidiki Jenis Peluru yang Ditembakkan Anggota Perintis Presisi ke Remaja Tawuran di Depok;https://www.liputan6.com/news/read/6136858/polisi-masih-selidiki-jenis-peluru-yang-ditembakkan-anggota-perintis-presisi-ke-remaja-tawuran-di-depok;"Liputan6.com, Jakarta - Polres Metro Depok turut membantu Propam Polda Metro Jaya mengusut insiden penembakan yang dilakukan anggota Tim Perintis Presisi Polres Metro Depok, terhadap dua tersangka tawuran, pada Sabtu 9 Agustus 2025. Diketahui, pada saat kejadian Tim Perintis Presisi Polres Metro Depok, berusaha membubarkan kelompok remaja yang akan tawuran menggunakan senjata tajam. Kasat Reskrim Polres Metro Depok, Kompol Made Gede Oka Utama mengatakan, penembakan terhadap dua tersangka tawuran menggunakan senjata tajam, sudah ditangani Patsus Propam Polda Metro Jaya. Penanganan anggota kepolisian yang melakukan penembak terhadap remaja melakukan tawuran masih dalam penyelidikan. Baca Juga ""Itu yang dapat kami jelaskan untuk mengenai masalah penembakan ataupun tindakan tegas dari anggota Sat Samapta Polres Metro Depok,"" ujar Made, Selasa (19/8/2025). Advertisement Polres Metro Depok bersama Polda Metro Jaya masih melakukan pendalaman, terkait alasan anggota kepolisian melakukan penembakan. Pihaknya telah meminta keterangan sejumlah saksi untuk mengungkap latar belakang penembakan. ""Kami masih melakukan pendalaman, semuanya kami lakukan pemeriksaan saksi-saksi dan kita akan update penanganan perkaranya,"" jelas Made. Made menegaskan, kedua anggota kepolisian melakukan penembakan sedang dilakukan pemeriksaan secara intensif di Propam Polda Metro Jaya. Polres Metro Depok belum dapat mengungkap penggunaan jenis peluru pada senjata, namun penggunaan senjata telah sesuai standar operasional prosedur (SOP). ""Apakah memang berisi dengan peluru karet dan ataupun peluru tajam, kita lakukan pendalaman, sudah kita lakukan proses penyelidikan,"" terang Made. "
Tak Mau Kalah dari Korea, Pramono Pertimbangkan Serius Rencana Ragunan Buka hingga Malam;https://www.liputan6.com/news/read/6136783/tak-mau-kalah-dari-korea-pramono-pertimbangkan-serius-rencana-ragunan-buka-hingga-malam;Liputan6.com, Jakarta - Gubernur DKI Jakarta Pramono Anung Wibowo mempertimbangkan secara matang terkait rencana operasional Taman Marga Satwa Ragunan di Jakarta Selatan, hingga malam hari. “Dalam mengambil keputusan, saya pasti akan mempertimbangkan secara matang-matang,” kata Pramono seperti dilansir Antara. Baca Juga Menurut dia, rencana itu tak hanya sekadar menyediakan tempat wisata malam untuk masyarakat, tetapi juga sekaligus membuka lapangan pekerjaan. Advertisement Apabila Ragunan dibuka hingga malam hari, tentu akan dibutuhkan pekerja tambahan. Lebih lanjut, pria yang akrab disapa Pram itu pun optimistis Ragunan dapat dibuka hingga malam hari bagi masyarakat. “Negara-negara dimanapun sekarang yang namanya zoo (kebun binatang), termasuk Singapura, Korea, Jepang, itu rata-rata buka pagi, siang, malam. Apakah Ragunan bisa? Tentunya kita atur dengan sangat rinci. Dan ini segera kita detailkan,” ujar Pramono. Kendati begitu, jika Ragunan dibuka hingga malam, tidak semua satwa akan ditampilkan seperti siang hari. Hanya beberapa satwa pilihan yang akan ditampilkan saat malam hari. Selain penampilan satwa, mobil pribadi pengunjung juga tak lagi diperbolehkan masuk. 
Heboh Kabar WNA Kehilangan 5.000 Dollar Saat Diperiksa di Bea Cukai Bandara, Ini Fakta Sebenarnya;https://www.liputan6.com/news/read/6136737/heboh-kabar-wna-kehilangan-5000-dollar-saat-diperiksa-di-bea-cukai-bandara-ini-fakta-sebenarnya;Liputan6.com, Jakarta Sebuah unggahan di media sosial menarasikan seorang warga negara asing (WNA) Amerika Serikat kehilangan uang saat diperiksa di Kantor Bea Cukai Soekarno-Hatta pada Sabtu, 16 Agustus 2025. Akun itu menceritakan rekannya kehilangan uang 5.000 dollar yang tersimpan di dompet. Kehilangan itu diduga saat dia pergi ke toilet. Tak terima, bule tersebut meminta kepada petugas di sana memperlihatkan rekaman CCTV di ruangan tersebut. Disebutkan, petugas tersebut menolak permintaan bule itu. Bea Cukai buka suara soal unggahan itu. Baca Juga  Advertisement
Kasus Tudingan Ijazah Palsu Jokowi Masih Berlanjut, Polisi Kembali Panggil Roy Suryo Cs;https://www.liputan6.com/news/read/6136571/kasus-tudingan-ijazah-palsu-jokowi-masih-berlanjut-polisi-kembali-panggil-roy-suryo-cs;"Liputan6.com, Jakarta Polisi kembali memanggil mantan Menteri Pemuda dan Olahraga (Menpora) Roy Suryo untuk dimintai keterangan sebagai saksi dalam kasus tudingan ijazah palsu presiden ketujuh, Joko Widodo atau Jokowi. Pemeriksaan dilakukan di Polda Metro Jaya pada Rabu, (20/8/2025). Baca Juga Kuasa hukum Roy Suryo Cs, Ahmad Khozinudin, mengatakan, kliennya akan datang bersama dua orang saksi lainnya. Advertisement ""Besok adalah pemeriksaan Pak Roy Suryo, Bung Rizal Fadila, dan Kurnia Tri Royani,"" kata dia di Polda Metro Jaya, Selasa (19/8/2025). Terpisah, Roy sendiri menyatakan siap hadir memenuhi panggilan penyidik. “Ya mas, sekitar jam 09.30. Undangan jam 10,” singkat dia, Selasa."
Pramono Anung Wanti-wanti Jakarta Jobfest 2025 Tak Bernasib Sama dengan Daerah Lain;https://www.liputan6.com/news/read/6136482/pramono-anung-wanti-wanti-jakarta-jobfest-2025-tak-bernasib-sama-dengan-daerah-lain;"Liputan6.com, Jakarta Gubernur DKI Jakarta, Pramono Anung menyoroti Jakarta Jobfest 2025 yang menghadirkan 37 perusahaan dengan 2.000 lowongan kerja. Ia berharap proses rekrutmen berlangsung terbuka, transparan, dan terkelola dengan baik. Hal ini disampaikannya usai membuka pelaksanaan pameran lowongan kerja atau Jakarta Jobfest 2025 di Velodrome, Rawa Mangun Jakarta Timur pada Selasa (19/8/2025). Baca Juga Pramono berharap Jakarta Jobfest 2025 tak mengalami masalah seperti di daerah lain, di mana jumlah lowongan terbatas tetapi pendaftar membludak, yang membuat kericuhan. Advertisement ""Saya tidak mau penyelenggaraan Jobfest ini seperti beberapa kejadian di daerah lain di luar Jakarta, di mana lowongan yang tersedia tidak seberapa banyaknya tetapi yang mendaftar dan hadir sampai puluhan ribu dan sampai ada yang pingsan, saya tidak mau itu terjadi,"" kata dia.  "
Terungkap Penyebab Cuaca Ekstrem di Jabodetabek hingga 22 Agustus 2025;https://www.liputan6.com/news/read/6136458/terungkap-penyebab-cuaca-ekstrem-di-jabodetabek-hingga-22-agustus-2025;Liputan6.com, Jakarta Badan Meteorologi, Klimatologi, dan Geofisika (BMKG) memperkirakan potensi cuaca ekstrem berupa hujan dengan intensitas sedang hingga lebat masih akan mengguyur wilayah Jabodetabek hingga 22 Agustus 2025. “Peningkatan curah hujan ini diprediksi akan berlangsung hingga 22 Agustus 2025, sehingga masyarakat diimbau tetap waspada terhadap potensi cuaca signifikan,” kata Kepala Pusat Meteorologi Publik BMKG Andri Ramdhani kepada Liputan6.com, Selasa (19/8/2025).
Ribuan Pelamar Damkar Jakarta Tak Lolos Administrasi, Kurang Tinggi hingga Tak Punya SIM B1;https://www.liputan6.com/news/read/6136420/ribuan-pelamar-damkar-jakarta-tak-lolos-administrasi-kurang-tinggi-hingga-tak-punya-sim-b1;"Liputan6.com, Jakarta - Sebanyak 24.405 orang tercatat memasukkan lamaran pekerjaan sebagai Penyedia Jasa Lainnya Perorangan untuk posisi petugas pemadam kebakaran (Damkar) DKI Jakarta. Dari jumlah itu, hanya 17 persen atau sekitar 4.200 pelamar saja yang memenuhi syarat administrasi. ""Dari 24 ribu itu, 17 persen yang memenuhi syarat administrasi,"" kata Gubernur DKI Jakarta, Pramono Anung menyebut di Plaza Bendera, Jakarta Timur, Selasa (19/8/2025)."
Upaya Kendalikan Hujan, Jakarta Lakukan Modifikasi Cuaca Selama 5 Hari;https://www.liputan6.com/news/read/6136270/upaya-kendalikan-hujan-jakarta-lakukan-modifikasi-cuaca-selama-5-hari;Liputan6.com, Jakarta Pemerintah Provinsi (Pemprov) DKI Jakarta melalui Badan Penanggulangan Bencana Daerah (BPBD) DKI Jakarta melaksanakan Operasi Modifikasi Cuaca (OMC) tahap keempat 2025. Hal ini sebagai langkah mitigasi cuaca ekstrem yang melanda wilayah DKI Jakarta. Baca Juga Kegiatan ini berlangsung selama lima hari yakni pada 17 hingga 21 Agustus 2025 dengan pusat operasi di Posko Bandara Halim Perdanakusuma. OMC ini merupakan kolaborasi antara BPBD DKI Jakarta, Badan Meteorologi Klimatologi dan Geofisika (BMKG), serta TNI Angkatan Udara. Advertisement “Langkah ini ditempuh sebagai bentuk mitigasi terhadap potensi peningkatan curah hujan di wilayah Jakarta dan sekitarnya pada periode 18-21 Agustus 2025,” kata Kepala Pelaksana BPBD DKI Jakarta, Isnawa Adji dalam keterangan tertulis, diterima Selasa (19/8/2025). 
Keluh Kesah Warga Jakarta Terjebak Macet Imbas Hujan yang Mengguyur Pagi Ini;https://www.liputan6.com/news/read/6136199/keluh-kesah-warga-jakarta-terjebak-macet-imbas-hujan-yang-mengguyur-pagi-ini;"Liputan6.com, Jakarta Jakarta diguyur hujan secara merata, Selasa (19/8/2025) pagi, dengan intensitasnya beragam, mulai dari deras hingga ringan. Kondisi ini juga membuat kemacetan di berbagai ruas jalan, terlebih dibarengi mereka yang hendak pergi kerja. Namun kondisi tersebut membuat dampak kemacetan berganda. Khususnya bagi mereka yang hendak pergi kerja. Baca Juga Salah satunya Yandhika, warga Ciledug yang biasa menggunakan transportasi publik untuk menuju kantornya di kawasan Bundaran Hotel Indonesia. Namun karena derasnya hujan, membuat dirinya harus menggunakan mobil. Advertisement ""Saya berangkat jam 7.00 WIB dari Ciledug,  tapi 08.30 masih di Senayan, kendaraan tidak bergerak,"" kata dia sembari mebagikan foto kondisi kemacetan di kawasan Senayan, Selasa (19/8/2025). Menurut dia situasi tersebut berbeda dengan kemarin, ketika momen cuti bersama. Dirinya hanya membutuhkan waktu 30 menit untuk sampai kantor. "
Hujan Mengguyur Jakarta, Arus Kendaraan di Tol Dalam Kota Padat;https://www.liputan6.com/news/read/6136147/hujan-mengguyur-jakarta-arus-kendaraan-di-tol-dalam-kota-padat;Liputan6.com, Jakarta Jakarta diguyur hujan secara merata, Selasa (19/8) pagi. Hujan turun sejak pukul 05.00 WIB dan belum berhenti hingga lewat pukul 08.00 WIB. Intensitasnya beragam, mulai dari deras hingga ringan. Dampak hujan tersebut, terpantau sejumlah ruas jalan mengalami volume kepadatan. Akun resmi sosial media dari TMC Polda Metro Jaya melaporkan, pada pukul 07.42 WIB situasi arus lalu lintas di ruas tol dalam kota KM 00+700 (Cawang) arah Pancoran terpantau padat. Sedangkan sebaliknya yang mengarah ke Cikampek dan Jagorawi terpantaj ramai lancar. Baca Juga Selanjutnya, pada pukul 07.15 WIB, situasi arus lalu lintas di traffic light PGC cililitan Jakarta timur arah jalan Dewi-Sartika maupun arah jalan raya Bogor terpantau ramai lancar. Advertisement
Jakarta Diprediksi Hujan Disertai Petir, Ini Kondisi 12 Pintu Air;https://www.liputan6.com/news/read/6136097/jakarta-diprediksi-hujan-disertai-petir-ini-kondisi-12-pintu-air;Liputan6.com, Jakarta Badan Meteorologi, Klimatologi dan Geofisika (BMKG) memprediksi wilayah Jakarta, Bogor, Depok, Tangerang dan Bekasi (Jabodetabek) berpotensi terjadi hujan dengan intensitas sedang hingga lebat yang dapat disertai kilat/petir dan angin kencang, Selasa (19/8). Prediksi ini berdasarkan data BMKG yang diperbarui pada pukul 05.50 WIB. Kondisi cuaca diperkirakan masih dapat berlangsung hingga pukul 09.00 WIB. Baca Juga Dikutip dari laman BMKG, berikut detailnya: Advertisement Kabupaten Kepulauan Seribu: Kepulauan Seribu Utara, Kepulauan Seribu Selatan., Kota Jakarta Pusat: Sawah Besar, Kota Jakarta Utara: Penjaringan, Tanjung Priok, Pademangan, Kabupaten Bekasi: Tarumajaya, Babelan, Sukawangi, Tambelang, Tambun Utara, Tambun Selatan, Cibitung, Cikarang Barat, Cikarang Utara, Karang Bahagia, Cikarang Timur, Kedung Waringin, Pebayuran, Sukakarya, Sukatani, Cabangbungin, Muaragembong, Cikarang Pusat, Bojongmangu, Kota Bekasi: Bekasi Timur,
